Title,Mapped Genres
The Black Witch,"fantasy, young adult, witches, romance, magic, young adult, fiction"
Shadow of Night,"fantasy, romance, fiction, historical, paranormal, vampires, witches"
Somewhere Towards the End,"memoir, non-fiction, biography, autobiography, biography, essays, womens"
Chain Of Iron,"fantasy, young adult, romance, historical, young adult, urban, paranormal"
The Lesbiana's Guide to Catholic School,"romance, lgbt, young adult, queer, lesbian, contemporary, fiction"
The Rocky Road Trip of Lydia Goldblatt and Julie Graham-Chang,"middle grade, graphic novel, childrens, humor, realistic fiction, fiction, lgbt"
On Chesil Beach,"fiction, historical, literary fiction, contemporary, romance, british literature, "
Over the Edge,"romance, romance, suspense, military, contemporary, contemporary, fiction"
Captain Underpants and the Sensational Saga of Sir Stink-a-Lot,"childrens, humor, fiction, graphic novel, middle grade, chapter books, comic book"
Moonlight Becomes You,"mystery, fiction, suspense, thriller, mystery, crime, adult"
Bewitching,"fantasy, young adult, romance, fairy tales, retellings, magic, witches"
Dating Makes Perfect,"romance, young adult, contemporary, young adult, young adult, enemies to lovers, fiction"
Sons of Fortune,"fiction, thriller, historical, drama, mystery, , politics"
The Beloved Wild,"historical, young adult, historical, fiction, romance, young adult, teen"
This is Not Forgiveness,"young adult, contemporary, romance, mystery, realistic fiction, drama, fiction"
The Never Tilting World,"fantasy, young adult, lgbt, romance, young adult, lesbian, fiction"
The Realm of Possibility,"young adult, poetry, lgbt, fiction, contemporary, romance, queer"
The Way We Never Were: American Families and the Nostalgia Trap,"historical, non-fiction, social, feminism, politics, american, historical"
An Echo in the Bone,"historical, romance, fantasy, fiction, time travel, historical, historical"
Skeleton Crew,"horror, short stories, fiction, fantasy, thriller, anthology, audiobook"
The Project,"young adult, thriller, mystery, contemporary, mystery, fiction, audiobook"
The Black Dahlia,"mystery, fiction, crime, noir, historical, true crime, thriller"
Anatomy of a Single Girl,"young adult, romance, new adult, contemporary, realistic fiction, fiction, young adult"
Things in Jars,"historical, fantasy, mystery, fiction, magic, historical, gothic"
They Wish They Were Us,"mystery, young adult, thriller, mystery, contemporary, fiction, audiobook"
Lucky Penny,"graphic novel, romance, young adult, humor, fiction, graphic novel, contemporary"
Queen of the Damned,"horror, fantasy, vampires, fiction, paranormal, supernatural, urban"
Home After Dark,"graphic novel, comic book, fiction, young adult, coming of age, historical, graphic novel"
The Perks of Being a Wallflower,"young adult, fiction, classics, coming of age, romance, mental health, realistic fiction"
See You at Harry's,"young adult, realistic fiction, middle grade, contemporary, fiction, family, death"
The World's Strongest Librarian: A Book Lover's Adventures,"non-fiction, memoir, biography, books about books, biography, audiobook, humor"
Murder of Crows,"young adult, mystery, lgbt, contemporary, mystery, fiction, thriller"
The Infinite Moment of Us,"young adult, romance, contemporary, realistic fiction, fiction, , teen"
13 Minutes,"young adult, mystery, thriller, fiction, contemporary, mystery, crime"
If There Be Thorns,"fiction, horror, young adult, romance, gothic, thriller, drama"
Slay,"young adult, contemporary, fiction, audiobook, realistic fiction, science fiction, young adult"
Anne Frank: The Anne Frank House Authorized Graphic Biography,"graphic novel, biography, non-fiction, historical, holocaust, comic book, historical"
Paradise Lost and Paradise Regained,"classics, poetry, fiction, , religion, philosophy, fantasy"
I Was a Teenage Fairy,"young adult, fantasy, fiction, magic, urban, romance, teen"
Beyond the Gender Binary,"non-fiction, lgbt, queer, gender, feminism, audiobook, memoir"
Banned Book Club,"graphic novel, non-fiction, memoir, historical, historical, biography, politics"
We All Looked Up,"young adult, contemporary, fiction, science fiction, romance, dystopia, realistic fiction"
In the Belly of the Beast: Letters From Prison,"non-fiction, biography, true crime, crime, memoir, psychology, biography"
Hear These Voices: Youth at the Edge of the Millennium,", non-fiction"
Dreaming of Antigone,"young adult, contemporary, romance, abuse, realistic fiction, poetry, death"
Anna and the French Kiss,"romance, young adult, contemporary, fiction, chick lit, realistic fiction, contemporary"
Ripley's Believe It or Not!: Shatter Your Senses!,"non-fiction, trivia"
The Awesomely Awful Melodies of Lydia Goldblatt and Julie Graham-Chang,"middle grade, graphic novel, childrens, humor, realistic fiction, juvenile, graphic novel"
The Girl Who Loved Tom Gordon,"horror, fiction, thriller, suspense, mystery, fantasy, audiobook"
Big Nate: A Good Old-Fashioned Wedgie,"graphic novel, humor, childrens, comic book, fiction, middle grade, juvenile"
Cherry Money Baby,"young adult, contemporary, romance, realistic fiction, fiction, coming of age, chick lit"
Dreamcatcher,"horror, fiction, science fiction, thriller, fantasy, aliens, supernatural"
The Food Chain (Play),"plays, theatre, drama"
The Waste Lands,"fantasy, fiction, horror, science fiction, audiobook, adventure, westerns"
Singin' and Swingin' and Gettin' Merry Like Christmas,"non-fiction, memoir, biography, autobiography, biography, african american, classics"
Messed Up,"young adult, realistic fiction, teen, fiction, urban, drama, survival"
Ramona Blue,"young adult, lgbt, contemporary, romance, queer, fiction, audiobook"
Shadow of the Hegemon,"science fiction, fiction, science fiction, fantasy, young adult, audiobook, adventure"
Written in My Own Heart's Blood,"historical, romance, fiction, fantasy, time travel, historical, historical"
I Know Why The Caged Bird Sings,"non-fiction, classics, memoir, biography, autobiography, poetry, feminism"
They Called Themselves The K.K.K.: The Birth of an American Terrorist Group,"non-fiction, historical, american, historical, teen, race, african american"
Fifty Shades of Grey,"fiction, erotica, bdsm, adult, contemporary, contemporary, chick lit"
You're Next,"mystery, young adult, thriller, lgbt, mystery, contemporary, fiction"
King of Battle and Blood,"fantasy, vampires, fantasy, romance, enemies to lovers, paranormal, adult"
Flawless,"young adult, mystery, fiction, contemporary, romance, chick lit, thriller"
The Last Words We Said,"young adult, romance, contemporary, judaism, realistic fiction, fiction, judaism"
Light Years,"young adult, israel, fiction, teen, realistic fiction, adult, war"
Micro,"science fiction, fiction, thriller, adventure, mystery, audiobook, horror"
Now Sheba Sings the Song,"poetry, art, african american, non-fiction"
Life,"music, biography, non-fiction, memoir, autobiography, audiobook, biography"
Red at the Bone,"fiction, historical, audiobook, contemporary, literary fiction, adult, lgbt"
Stolen Girl,"historical, middle grade, historical, young adult, fiction, world war ii, war"
The Feeling of Falling in Love,"romance, lgbt, queer, young adult, contemporary, fiction, transgender"
The Dharma Bums,"fiction, classics, , , travel, philosophy, american"
The Nowhere Girls,"young adult, contemporary, feminism, lgbt, fiction, realistic fiction, young adult"
Terrorism Inc.: The Financing of Terrorism Insurgency and Irregular Warfare,non-fiction
Are These My Basoomas I See Before Me: Fab Final Confessions of Georgia Nicolson,"young adult, romance, humor, fiction, contemporary, chick lit, teen"
The Love and Lies of Rukhsana Ali,"young adult, lgbt, contemporary, queer, romance, fiction, lesbian"
The Grownup,"short stories, fiction, horror, thriller, mystery, mystery, audiobook"
Hoop City: Chicago,"sports, young adult, realistic fiction"
On the Volcano,"historical, young adult, westerns, survival, coming of age, historical"
A Secret Kept,"fiction, historical, france, mystery, adult, contemporary, audiobook"
Leonardo da Vinci,"biography, art"
Opposition,"young adult, fantasy, romance, paranormal, aliens, science fiction, paranormal"
That Hideous Strength: A Modern Fairy-Tale for Grown-Ups,"fiction, science fiction, fantasy, christianity, classics, christianity, science fiction"
Playing Hard to Get,"sports, romance, sports, college, football, new adult, friends to lovers"
Ender's Shadow,"science fiction, fiction, young adult, fantasy, science fiction, audiobook, space"
Kingdom of Ash,"young adult, romance, romance, fae, fiction, magic, new adult"
The Second Summer Of The Sisterhood,"young adult, fiction, chick lit, contemporary, romance, teen, realistic fiction"
The Black Kids,"young adult, historical, contemporary, fiction, audiobook, historical, race"
After We Collided,"romance, new adult, young adult, contemporary, fiction, college, contemporary"
Fly on the Wall: How One Girl Saw Everything,"young adult, contemporary, fantasy, fiction, romance, magic, chick lit"
The Imitation Game: Alan Turing Decoded,"graphic novel, non-fiction, biography, historical, comic book, science, lgbt"
Since You've Been Gone,"young adult, contemporary, romance, fiction, young adult, realistic fiction, audiobook"
The Hate U Give,"young adult, fiction, contemporary, audiobook, realistic fiction, race, social"
The List of Things That Will Not Change,"middle grade, realistic fiction, lgbt, fiction, family, contemporary, audiobook"
Say What You Will,"young adult, romance, contemporary, fiction, realistic fiction, disability, mental health"
All That's Left in the World,"romance, lgbt, young adult, queer, dystopia, science fiction, fiction"
Recess Warriors: Hero Is A Four-Letter Word,"graphic novel, fantasy, middle grade, comic book, juvenile, adventure, childrens"
Big Nate: The Crowd Goes Wild,"graphic novel, comic book, childrens, humor, fiction, middle grade, school"
The Absolute Value of -1,"young adult, contemporary, fiction, realistic fiction, death, teen"
Maus 1: A Survivor's Tale: My Father Bleeds History,"graphic novel, comic book, historical, non-fiction, memoir, holocaust, biography"
Snakeroot,"young adult, fantasy, paranormal, werewolves, romance, magic, supernatural"
All the Invisible Things,"lgbt, young adult, contemporary, queer, romance, fiction, bisexual"
Two-Way Street,"young adult, romance, contemporary, road trip, chick lit, realistic fiction, fiction"
You Don't Know Me,"young adult, fiction, realistic fiction, abuse, contemporary, teen, high school"
Lobizona,"fantasy, young adult, fiction, magic, paranormal, urban, young adult"
The Passage,"horror, fiction, science fiction, fantasy, post apocalyptic, vampires, dystopia"
Confessions of a Shopaholic,"chick lit, fiction, romance, contemporary, humor, adult, contemporary"
Cut,"young adult, fiction, mental health, realistic fiction, mental health, contemporary, psychology"
Kindred: A Graphic Novel Adaptation,"graphic novel, historical, fiction, science fiction, time travel, fantasy, historical"
Christine,"horror, fiction, thriller, fantasy, paranormal, supernatural, mystery"
Divine Secrets of the Ya-Ya Sisterhood,"fiction, chick lit, contemporary, adult, historical, southern, adult"
Blackout,"romance, young adult, short stories, contemporary, lgbt, fiction, audiobook"
Sudden Fiction: American Short Stories,"short stories, fiction, anthology, fiction, literary fiction, contemporary, school"
Hurricane Child,"middle grade, lgbt, magic, queer, fiction, young adult, contemporary"
Bangkok 8,"mystery, fiction, crime, thriller, asia, mystery, detective"
Wonder Woman: Warbringer,"fantasy, young adult, superheroes, fiction, mythology, audiobook, retellings"
Elevation,"fiction, horror, fantasy, audiobook, short stories, mystery, novella"
Insatiable,"romance, vampires, fantasy, paranormal, chick lit, fiction, paranormal"
Princess in Training,"young adult, romance, fiction, contemporary, chick lit, teen, childrens"
Plague in the Mirror,"young adult, historical, time travel, fantasy, romance, paranormal, historical"
Bloody Valentine,"vampires, young adult, fantasy, paranormal, romance, angels, urban"
When Aidan Became a Brother,"picture books, lgbt, family, childrens, realistic fiction, queer, gender"
Illuminae,"science fiction, young adult, romance, fantasy, fiction, audiobook, dystopia"
Who Is Dolly Parton?,"biography, non-fiction, childrens, music, middle grade, historical, biography"
Monsters,"young adult, zombies, dystopia, horror, post apocalyptic, science fiction, fiction"
Wuthering Heights,"fiction, gothic, historical, , historical, , 19th century"
Too Soon For Jeff,"fiction, young adult, teen"
Lightning,"romance, fiction, chick lit, contemporary, adult, contemporary, drama"
Sleeping Beauties,"horror, fantasy, fiction, thriller, audiobook, mystery, science fiction"
Everything Everything,"young adult, romance, contemporary, fiction, realistic fiction, audiobook, young adult"
Glimpse: A YA Paranormal Romance,"young adult, paranormal, fantasy, romance, paranormal, supernatural, fiction"
Perfidia,"fiction, contemporary"
Monkey Man,mystery
Keeper,"fantasy, middle grade, fiction, young adult, childrens, magic, mermaids"
Téo's Tutu,"picture books, lgbt, childrens, queer, gender, realistic fiction, fiction"
Finding Yvonne,"contemporary, young adult, romance, realistic fiction, fiction, young adult, audiobook"
101 Ways to Dance,"short stories, young adult, canada, teen"
The Way We Work: Getting to Know the Amazing Human Body,"science, non-fiction, reference, childrens, biology, health, bodies"
Wrong About the Guy,"young adult, romance, retellings, contemporary, chick lit, young adult, contemporary"
Across the Universe,"young adult, science fiction, dystopia, romance, fantasy, fiction, mystery"
Reign,"romance, young adult, audiobook, fiction, contemporary, chick lit, fantasy"
Postcards From No Man's Land,"young adult, historical, fiction, historical, war, lgbt, realistic fiction"
Sawkill Girls,"horror, young adult, fantasy, lgbt, mystery, fiction, thriller"
Before the Devil Breaks You,"fantasy, historical, young adult, paranormal, audiobook, horror, historical"
Dragonfly in Amber,"historical, romance, fantasy, fiction, time travel, historical, historical"
Walk Two Moons,"young adult, fiction, middle grade, childrens, realistic fiction, school, classics"
Maybe He Just Likes You,"middle grade, realistic fiction, fiction, young adult, contemporary, audiobook, childrens"
Children of Blood and Bone,"fantasy, young adult, fiction, audiobook, magic, young adult, romance"
Beautiful Redemption,"fantasy, young adult, paranormal, romance, fiction, magic, supernatural"
Losing Hope,"romance, new adult, young adult, contemporary, fiction, contemporary, abuse"
Burned (SS),"young adult, mystery, fiction, contemporary, romance, thriller, chick lit"
Falling into Place,"young adult, contemporary, fiction, mental health, realistic fiction, young adult, mental health"
One Life,"non-fiction, memoir, sports, audiobook, lgbt, biography, feminism"
The Silent Wife,"fiction, thriller, mystery, mystery, audiobook, suspense, psychology"
The Rest of Us Just Live Here,"young adult, fantasy, contemporary, fiction, lgbt, audiobook, paranormal"
The Underground Railroad,"historical, fiction, historical, audiobook, literary fiction, race, african american"
King Dork,"young adult, fiction, humor, mystery, teen, music, coming of age"
Titans and Olympians: Greek and Roman Myth,"mythology, historical, reference, greek mythology, folklore, non-fiction"
The Truth of Right Now,"young adult, contemporary, romance, coming of age, realistic fiction, mental health, family"
A Breath of Snow and Ashes,"historical, romance, fantasy, fiction, time travel, historical, historical"
Mask of Shadows,"fantasy, young adult, lgbt, queer, fiction, young adult, romance"
Sweet Treats and Secret Crushes,"romance, young adult, middle grade, realistic fiction, contemporary, fiction, chick lit"
End of Watch,"horror, fiction, thriller, mystery, crime, audiobook, mystery"
War Storm,"fantasy, young adult, dystopia, romance, fiction, young adult, audiobook"
Cashelmara,"historical, fiction, ireland, historical, romance, 19th century, gothic"
Forging the Darksword,"fantasy, fiction, science fiction, high fantasy, magic, epic, dragons"
Crave,"fantasy, romance, young adult, vampires, paranormal, audiobook, fiction"
Champion,"dystopia, young adult, romance, fantasy, science fiction, fiction, audiobook"
Revival,"horror, fiction, thriller, audiobook, fantasy, mystery, science fiction"
Teen Spirit,"young adult, fantasy, paranormal, ghosts, supernatural, fiction, romance"
Of Jenny and the Aliens,"young adult, science fiction, romance, fiction, aliens, contemporary, teen"
The Word for Yes,"young adult, contemporary, realistic fiction, fiction, young adult, social, high school"
Grace and Glory,"fantasy, romance, paranormal, young adult, audiobook, urban, angels"
Don't Say a Word,"thriller, fiction, crime, mystery, suspense, mystery, adult"
Wash Day Diaries,"graphic novel, comic book, fiction, contemporary, lgbt, queer, adult"
The Darkest Minds,"young adult, dystopia, fantasy, science fiction, romance, fiction, paranormal"
The Dead Inside,"memoir, non-fiction, mental health, abuse, autobiography, adult, biography"
Debating Darcy,"young adult, romance, contemporary, retellings, fiction, audiobook, realistic fiction"
The Elegant Gathering of White Snows,"fiction, chick lit, book club, contemporary, womens, womens, adult"
Alichino,"manga, fantasy, graphic novel, comic book, shojo, fiction, horror"
Lore Olympus: Volume Two,"graphic novel, fantasy, romance, mythology, comic book, retellings, fiction"
Glory O'Brien's History of the Future,"young adult, magic, fantasy, contemporary, fiction, science fiction, teen"
Through the Ever Night,"young adult, dystopia, fantasy, romance, science fiction, post apocalyptic, fiction"
Born a Crime: Stories from a South African Childhood,"non-fiction, memoir, biography, audiobook, humor, autobiography, africa"
The Third Side: Why We Fight and How We Can Stop,"non-fiction, psychology, philosophy, management, business, social"
Good Idea,"mystery, young adult, fiction, thriller, lgbt, mystery, audiobook"
Making Bombs for Hitler,"historical, middle grade, young adult, historical, world war ii, fiction, war"
Tangled,"young adult, romance, contemporary, realistic fiction, chick lit, teen, fiction"
The Power of Six,"young adult, fantasy, science fiction, fiction, aliens, adventure, paranormal"
The Treatment,"dystopia, young adult, romance, science fiction, fiction, mental health, audiobook"
The Boleyn Inheritance,"historical, fiction, historical, romance, tudor period, british literature, adult"
Ugly Love,"contemporary, new adult, fiction, contemporary, audiobook, adult, chick lit"
Lair of Dreams,"fantasy, young adult, historical, paranormal, audiobook, mystery, historical"
The Mark of Athena,"fantasy, mythology, young adult, fiction, middle grade, adventure, greek mythology"
How to Be Popular,"young adult, romance, contemporary, chick lit, fiction, teen, realistic fiction"
The Lords of Discipline,"fiction, historical, military, southern, classics, , coming of age"
Final Appeal,"mystery, fiction, thriller, law, mystery, suspense, crime"
Genesis Begins Again,"middle grade, realistic fiction, young adult, fiction, contemporary, african american, family"
Night Star,"young adult, fantasy, paranormal, romance, fiction, supernatural, paranormal"
Boy Girl Boy,"young adult, lgbt, , fiction, queer, teen, romance"
Dead End,"young adult, realistic fiction, romance, fiction, contemporary, abuse, mystery"
Bait,"young adult, fiction, abuse, lgbt, contemporary, realistic fiction, teen"
WeirDo Series: Mega Weird!,"childrens, fiction, school"
Geektastic: Stories from the Nerd Herd,"short stories, young adult, fiction, anthology, contemporary, humor, fantasy"
Taken at Dusk,"fantasy, young adult, paranormal, vampires, romance, werewolves, supernatural"
Hold Still,"young adult, contemporary, mental health, fiction, realistic fiction, lgbt, romance"
Tempted (CVZ),"young adult, chick lit, contemporary, fiction, romance, high school, boarding school"
The Dark Prophecy,"fantasy, mythology, young adult, middle grade, fiction, adventure, greek mythology"
Escape the Mask,"fantasy, young adult, dystopia, childrens"
Goat Girls: Two Weetzie Bat Books,"young adult, fiction, fantasy, magic, romance, urban, magic"
Dash and Lily's Book of Dares,"young adult, romance, contemporary, christmas, fiction, holiday, realistic fiction"
The Gift (DS),"romance, fiction, chick lit, adult, drama, contemporary, contemporary"
Neferet's Curse,"young adult, fantasy, vampires, paranormal, fiction, romance, supernatural"
Evil Queen,"fantasy, young adult, retellings, romance, young adult, magic, fiction"
No More Excuses: Dismantling Rape Culture,"non-fiction, feminism, adult, social, politics, womens, womens"
Punching Bag,"young adult, mental health, abuse, biography, middle grade, teen, survival"
The Impossible Knife of Memory,"young adult, contemporary, realistic fiction, fiction, romance, mental health, mental health"
How I Grew,"memoir, biography, non-fiction, autobiography, american, biography"
Geography Club,"young adult, lgbt, fiction, queer, contemporary, gay, romance"
The Unbearable Lightness of Being,"fiction, philosophy, , , romance, czech literature, classics"
A Long Walk to Water: Based on a True Story,"historical, young adult, middle grade, fiction, africa, school, realistic fiction"
Wild Tongues Can't Be Tamed: 15 Voices from the Latinx Diaspora,"short stories, young adult, poetry, anthology, audiobook, essays, lgbt"
The Girl Before,"thriller, mystery, fiction, mystery, suspense, audiobook, psychology"
The Rumor Game,"young adult, contemporary, mystery, thriller, mental health, mystery, realistic fiction"
Vampire Academy (A Graphic Novel),"graphic novel, vampires, young adult, fantasy, paranormal, romance, comic book"
The Road,"fiction, science fiction, dystopia, post apocalyptic, horror, , "
Feral Youth,"young adult, short stories, contemporary, anthology, lgbt, fiction, retellings"
Tin Star,"science fiction, young adult, aliens, space, romance, fiction, dystopia"
Caravaggio: Painter on the Run,"historical, young adult, historical, fiction"
The Casual Vacancy,"fiction, contemporary, mystery, adult, adult, audiobook, drama"
Manga Shakespeare: A Midsummer Night's Dream,"manga, fantasy, graphic novel, classics, comic book, romance, plays"
Papillon,"non-fiction, biography, classics, memoir, adventure, autobiography, france"
One Hundred Years of Solitude,"fiction, magic, fantasy, , historical, , spain"
Shiver,"young adult, fantasy, romance, paranormal, werewolves, fiction, paranormal"
Chocolat,"fiction, romance, magic, france, fantasy, contemporary, historical"
Lulu is a Rhinoceros,"picture books, childrens, animals, dogs, fiction, humor, graphic novel"
The Guernsey Literary and Potato Peel Pie Society,"historical, fiction, romance, historical, world war ii, audiobook, book club"
Burned (PCC),"young adult, vampires, fantasy, paranormal, romance, fiction, supernatural"
A Painted House,"fiction, historical, mystery, thriller, suspense, historical, "
The Lucky One,"romance, fiction, chick lit, contemporary, adult, contemporary, adult"
Kiss Number 8,"graphic novel, lgbt, young adult, comic book, queer, romance, fiction"
Fever Crumb,"steampunk, young adult, fantasy, science fiction, fiction, dystopia, teen"
Dreamplace,"picture books, childrens"
Girls In Pants: The Third Summer Of The Sisterhood,"young adult, fiction, chick lit, contemporary, romance, teen, realistic fiction"
Can You See Me?,"autistic spectrum disorder, middle grade, fiction, contemporary, disability, young adult, realistic fiction"
Montana 1948,"fiction, historical, westerns, coming of age, school, classics, literary fiction"
Zen and the Art of Faking It,"young adult, realistic fiction, fiction, humor, middle grade, teen, contemporary"
Hopeless,"romance, new adult, young adult, contemporary, fiction, contemporary, abuse"
The Pants Project,"lgbt, middle grade, young adult, contemporary, realistic fiction, fiction, queer"
A Feast for Crows,"fantasy, fiction, epic, high fantasy, science fiction, adult, audiobook"
That Weekend,"mystery, young adult, thriller, mystery, audiobook, fiction, contemporary"
Daughter of the Forest,"fantasy, romance, fiction, historical, young adult, fairy tales, retellings"
Dragons of Darkness,"fantasy, dragons, young adult, urban, fiction"
The Man from St. Petersburg,"fiction, historical, thriller, mystery, historical, suspense, espionage"
A People's History of the United States,"historical, non-fiction, politics, american, historical, audiobook, social"
Iron Widow,"fantasy, science fiction, young adult, lgbt, queer, fiction, romance"
This Book Is Gay,"non-fiction, lgbt, , queer, gay, self help, humor"
Envy,"historical, young adult, romance, historical, fiction, historical, chick lit"
Wicked: Memorias de una bruja mala,"fantasy, fiction, adult, retellings, audiobook, witches, classics"
Blaine for the Win,"young adult, romance, contemporary, lgbt, queer, fiction, audiobook"
Brides of Eden: A True Story Imagined,"historical, young adult, fiction, historical, cults, teen, "
Surrender Your Sons,"young adult, lgbt, thriller, contemporary, queer, mystery, fiction"
Gates of Paradise,"young adult, vampires, fantasy, paranormal, romance, angels, supernatural"
Slaughterhouse-Five,"fiction, science fiction, classics, historical, war, , "
Happiness Sold Separately,"fiction, chick lit, romance, contemporary, audiobook, adult, adult"
The Rule of Claw,"science fiction, dystopia, young adult, adventure, fiction"
Heroine,"young adult, contemporary, fiction, realistic fiction, audiobook, mental health, sports"
Sail,"mystery, fiction, thriller, suspense, crime, mystery, audiobook"
