Title,Mapped Genres
The Electric Heir (Feverwake Series),"fantasy, young adult, lgbt, science fiction, dystopia, romance, queer"
Smoky Night,"picture books, childrens, historical, realistic fiction, fiction, cultural, family"
Lighter than My Shadow,"graphic novel, non-fiction, memoir, mental health, comic book, graphic novel, biography"
Flying the Dragon,"middle grade, realistic fiction, fiction, family, childrens, cultural, young adult"
Under Threat,"lgbt, young adult, contemporary, realistic fiction, fiction, lesbian, social"
Hello Now,"young adult, fantasy, lgbt, romance, contemporary, audiobook, queer"
Eagle Feather,"fiction, historical, american, childrens"
All the Invisible Things,"lgbt, young adult, contemporary, queer, romance, fiction, bisexual"
Rising Out,"young adult, romance, poetry, lgbt, queer"
Jesus Land: A Memoir,"memoir, non-fiction, religion, biography, biography, autobiography, cults"
Beast,"young adult, romance, lgbt, contemporary, retellings, fiction, queer"
Lola Levine and the Halloween Scream (Lola Levine Series),"halloween, middle grade, chapter books, , childrens"
How to Make a Wish,"lgbt, contemporary, young adult, romance, lesbian, queer, fiction"
Things We Couldn't Say,"young adult, lgbt, contemporary, romance, queer, fiction, sports"
Pet,"fantasy, young adult, lgbt, fiction, queer, magic, audiobook"
I Am Rosa Parks,"biography, picture books, non-fiction, childrens, historical, african american, historical"
Tomboy: A Graphic Memoir,"graphic novel, memoir, non-fiction, comic book, biography, feminism, gender"
Ada Byron Lovelace and the Thinking Machine,"picture books, biography, non-fiction, science, historical, mathematics, childrens"
Tarnished Are the Stars,"science fiction, lgbt, young adult, fantasy, queer, lesbian, romance"
Swimming with Faith: The Missy Franklin Story (ZonderKidz Biography Series),"biography, middle grade, non-fiction"
Revealed (House of Night Series),"fantasy, young adult, vampires, paranormal, romance, fiction, supernatural"
A Kids Book About Racism,"childrens, picture books, non-fiction, race, anti racist, parenting, social"
And Still I Rise,"poetry, classics, feminism, non-fiction, audiobook, race, african american"
A Dog Named Haku: A Holiday Story from Nepal,"picture books, holiday, dogs, childrens, animals, asia, realistic fiction"
We March,"picture books, historical, childrens, african american, social, cultural, historical"
Out Now: Queer We Go Again!,"short stories, lgbt, anthology, young adult, queer, fantasy, romance"
What Drowns the Flowers in Your Mouth: A Memoir of Brotherhood,"lgbt, memoir, non-fiction, mental health, biography, queer"
Elevation,"fiction, horror, fantasy, audiobook, short stories, mystery, novella"
Naomi and Ely's No Kiss List,"young adult, romance, contemporary, lgbt, fiction, realistic fiction, queer"
Little Leaders: Bold Women in Black History,"non-fiction, picture books, biography, historical, childrens, feminism, middle grade"
Ninth Ward (The Louisiana Girls Trilogy Series),"historical, middle grade, young adult, realistic fiction, fiction, african american, childrens"
The Handmaid's Tale: The Graphic Novel,"graphic novel, dystopia, fiction, comic book, feminism, science fiction, classics"
The Difference Between You and Me,"lgbt, young adult, romance, fiction, queer, contemporary, realistic fiction"
Saturdays with Hitchcock,"middle grade, lgbt, realistic fiction, fiction, young adult, juvenile, romance"
Who Is Sonia Sotomayor? (Who was...? Series),"biography, non-fiction, historical, childrens, middle grade, biography, american"
How to Be an Antiracist,"non-fiction, race, social, politics, audiobook, anti racist, historical"
The Love Curse of Melody McIntyre,"romance, lgbt, young adult, contemporary, lesbian, queer, fiction"
The Will of the Empress (The Circle Reforged Series),"fantasy, young adult, fiction, magic, young adult, high fantasy, teen"
Sadako,"picture books, japan, historical, biography, war, non-fiction, childrens"
WeirDo Series: Spooky Weird!,"childrens, fiction, graphic novel"
I'm a Pretty Little Black Girl!,"picture books, childrens, african american"
The Falling in Love Montage,"romance, lgbt, lesbian, young adult, queer, contemporary, fiction"
Being Jazz: My Life as a (Transgender) Teen,"non-fiction, lgbt, memoir, audiobook, biography, queer, biography"
When They Call You a Terrorist (Young Adult Edition): A Story of Black Lives Matter and the Power to Change the World,"young adult, audiobook, african american, mental health, politics, race, historical"
Escape from the Roller Ghoster (Desmond Cole Ghost Patrol Series),"chapter books, humor"
City of Heavenly Fire (The Mortal Instruments Series),"fantasy, young adult, romance, paranormal, urban, vampires, fiction"
The Hero Two Doors Down: Based on the True Story of Friendship between a Boy and a Baseball Legend,"historical, middle grade, sports, baseball, childrens, audiobook, juvenile"
The Whispers,"middle grade, lgbt, fantasy, fiction, young adult, queer, mystery"
Edie in Between,"fantasy, young adult, lgbt, lesbian, witches, contemporary, fiction"
Who Is Malala Yousafzai? (Who was...? Series),"biography, non-fiction, childrens, historical, middle grade, chapter books, kids"
Eagle Song,"native american, childrens, fiction, middle grade, realistic fiction, school, cultural"
Rapture Practice: A True Story About Growing Up Gay in an Evangelical Family,"memoir, non-fiction, lgbt, religion, biography, biography, queer"
My Mixed-Up Berry Blue Summer,"middle grade, lgbt, realistic fiction, fiction, childrens, family, young adult"
White Rabbit,"mystery, young adult, lgbt, thriller, fiction, romance, mystery"
Thunder Boy Jr.,"picture books, childrens, family, realistic fiction, native american, indigenous, cultural"
Yasmin the Recycler (Yasmin Series),"picture books, childrens, chapter books, fiction"
The House of the Spirits,"fiction, magic, historical, fantasy, spain, historical, "
Here's to Us,"romance, lgbt, young adult, contemporary, queer, fiction, audiobook"
Target,"young adult, abuse, contemporary, lgbt, realistic fiction, fiction, queer"
Heather Has Two Mommies,"lgbt, picture books, , childrens, fiction, family, queer"
Yaqui Delgado Wants to Kick Your Ass,"young adult, realistic fiction, fiction, contemporary, teen, audiobook, family"
The Outsiders,"classics, young adult, fiction, school, school, coming of age, realistic fiction"
Ghost Boys,"middle grade, young adult, fiction, realistic fiction, historical, contemporary, social"
Max and the Tag-Along Moon,"picture books, childrens, family, fiction, storytime, african american, love"
Separate Is Never Equal: Sylvia Mendez and Her Family’s Fight for Desegregation,"picture books, non-fiction, historical, biography, childrens, cultural, historical"
Understanding Gender Identity,non-fiction
SELF-ish: A Transgender Awakening,"memoir, non-fiction, lgbt, feminism, queer, transgender"
Phoenix Goes to School: A Story to Support Transgender and Gender Diverse Children,"lgbt, picture books, childrens, transgender, gender, school, non-fiction"
I Am Water,"young adult, lgbt, poetry, queer"
Spotlight on Coding Club! (Girls Who Code Series),"middle grade, coding, realistic fiction, childrens"
The Field Guide to the North American Teenager,"young adult, contemporary, fiction, realistic fiction, audiobook, humor, romance"
Rainbow High (Rainbow Trilogy Series),"young adult, lgbt, gay, romance, fiction, queer, realistic fiction"
Unusual Chickens for the Exceptional Poultry Farmer (Unusual Chickens Series),"middle grade, fantasy, humor, animals, childrens, fiction, magic"
Girl Made of Stars,"young adult, contemporary, lgbt, fiction, queer, romance, lesbian"
All Our Hidden Gifts (All Our Hidden Gifts Series),"fantasy, young adult, lgbt, queer, fiction, paranormal, witches"
House of Furies (House of Furies Series),"horror, young adult, fantasy, paranormal, historical, gothic, mystery"
Striving for Equality: LGBTQ Athletes Claim the Field,"non-fiction, sports, lgbt, , transgender, queer"
Cut Both Ways,"lgbt, young adult, contemporary, romance, realistic fiction, fiction, gay"
The 57 Bus: A True Story of Two Teenagers and the Crime That Changed Their Lives,"non-fiction, lgbt, true crime, audiobook, crime, social, queer"
Forever for a Year,"young adult, romance, contemporary, fiction, teen, realistic fiction, "
A Little Piece of Ground,"fiction, young adult, historical, middle grade, war, childrens, sports"
The Truth Is,"young adult, lgbt, contemporary, romance, queer, realistic fiction, fiction"
An Indigenous Peoples' History of the United States,"historical, non-fiction, indigenous, social, race, native american, audiobook"
Beloved,"fiction, classics, historical, magic, historical, , school"
Two Roads,"historical, middle grade, historical, native american, fiction, indigenous, young adult"
Yasmin the Librarian (Yasmin Series),"childrens, picture books, school, fiction, chapter books, books about books, realistic fiction"
Heartstopper: Volume Two (Heartstopper Series),"graphic novel, lgbt, young adult, queer, contemporary, comic book, fiction"
Blindspot: Hidden Biases of Good People,"non-fiction, psychology, science, anti racist, race, social, social"
We Are the Ants,"young adult, lgbt, contemporary, science fiction, fiction, queer, romance"
Tameka's New Dress,childrens
Cherry,"young adult, contemporary, romance, lgbt, fiction, chick lit, realistic fiction"
The New Jim Crow: Mass Incarceration in the Age of Colorblindness,"non-fiction, historical, politics, race, social, social, audiobook"
Most Valuable Players (Rip and Red Series),"middle grade, realistic fiction"
The Bell Jar,"fiction, feminism, mental health, psychology, , literary fiction, "
Who Was Maya Angelou? (Who was...? Series),"biography, non-fiction, childrens, historical, middle grade, biography"
Shine,"young adult, mystery, fiction, realistic fiction, contemporary, lgbt, teen"
My Awesome/Awful Popularity Plan (Justin Goldblatt Series),"young adult, lgbt, humor, fiction, contemporary, gay, audiobook"
The Beach Trip (Sofía Martínez Series),"childrens, spain, chapter books, fiction"
We Are Lost and Found,"lgbt, young adult, historical, queer, contemporary, romance, historical"
Esperanza Rising,"historical, middle grade, young adult, fiction, childrens, school, historical"
Yasmin the Friend (Yasmin Series),"fiction, childrens, realistic fiction, picture books"
The Black Flamingo,"poetry, lgbt, young adult, contemporary, queer, fiction, audiobook"
Becoming Nicole: The inspiring story of transgender actor-activist Nicole Maines and her extraordinary family,"non-fiction, lgbt, biography, memoir, audiobook, queer, gender"
Lush,"young adult, realistic fiction, , fiction, middle grade, teen, contemporary"
Unpregnant,"young adult, contemporary, fiction, feminism, realistic fiction, audiobook, young adult"
Happy families,"young adult, lgbt, realistic fiction, fiction, queer, family, transgender"
Feed,"young adult, science fiction, dystopia, fiction, teen, audiobook, fantasy"
The Nowhere Girls,"young adult, contemporary, feminism, lgbt, fiction, realistic fiction, young adult"
Our Skin: A First Conversation About Race,"picture books, childrens, non-fiction, race, social, , anti racist"
Infinity Son (Infinity Cycle Series),"fantasy, young adult, lgbt, queer, fiction, urban, audiobook"
It's Not Like It's a Secret,"lgbt, young adult, romance, contemporary, queer, lesbian, fiction"
Life is Funny,"young adult, , realistic fiction, short stories, fiction, contemporary, teen"
The Missing Mouse (Sofía Martínez Series),"spain, chapter books, childrens, picture books"
Triangles,"poetry, fiction, romance, contemporary, adult, young adult, adult"
The (Un)Popular Vote,"lgbt, young adult, contemporary, queer, romance, fiction, transgender"
Far from You,"young adult, mystery, lgbt, contemporary, romance, lesbian, thriller"
In the Dream House,"non-fiction, memoir, lgbt, queer, audiobook, horror, feminism"
Salvage the Bones (Bois Sauvage Series),"fiction, contemporary, literary fiction, historical, african american, , adult"
Yasmin the Teacher (Yasmin Series),"picture books, childrens, fiction, juvenile, chapter books"
Clean Getaway,"middle grade, realistic fiction, fiction, audiobook, adventure, family, contemporary"
Looking for Bongo,"picture books, family, childrens, cultural, storytime, fiction, spain"
Thirteen Reasons Why,"young adult, fiction, contemporary, realistic fiction, mystery, mental health, teen"
Who Was Rachel Carson? (Who was...? Series),"biography, non-fiction, science, nature, historical, childrens, middle grade"
Wonders of the Invisible World,"lgbt, fantasy, young adult, magic, queer, fiction, romance"
Black Girl Unlimited: The Remarkable Story of a Teenage Wizard,"fantasy, young adult, magic, contemporary, fiction, audiobook, young adult"
Cinderella Is Dead,"fantasy, young adult, lgbt, romance, queer, retellings, lesbian"
Bowery Girl,"historical, young adult, historical, 19th century, fiction, young adult, teen"
The Magical Yet,"picture books, childrens, growth mindset, inspirational, storytime, fiction, fantasy"
Anger Is a Gift: A Novel,"young adult, contemporary, lgbt, fiction, queer, realistic fiction, mental health"
The Bridge,"young adult, lgbt, fiction, mental health, contemporary, realistic fiction, audiobook"
The Pants Project,"lgbt, middle grade, young adult, contemporary, realistic fiction, fiction, queer"
Out of the Easy,"historical, young adult, historical, fiction, mystery, romance, coming of age"
Pedagogy of the Oppressed,"education, non-fiction, philosophy, politics, theory, social, teaching"
Where We Go From Here,"lgbt, contemporary, young adult, queer, fiction, romance, audiobook"
One of Those Hideous Books Where the Mother Dies,"young adult, poetry, realistic fiction, contemporary, fiction, teen, high school"
Draw Me a Star,"picture books, childrens, , art, fiction, space, nature"
The Ultimate Guys' Body Book: Not-So-Stupid Questions About Your Body,"science, parenting, childrens, health, family, non-fiction"
Black Youth Rising: Activism and Radical Healing in Urban America,"education, social, non-fiction, anti racist, race, activism"
Perfect (Impulse Series),"young adult, poetry, fiction, contemporary, realistic fiction, mental health, mental health"
Sofia's Party Shoes (Sofía Martínez Series),"childrens, spain, realistic fiction, chapter books"
Pink!,"picture books, childrens, fiction, animals, birds, family, emotion"
Bait,"young adult, fiction, abuse, lgbt, contemporary, realistic fiction, teen"
25 Women Who Dared to Go,historical
Tell Me Again How a Crush Should Feel,"lgbt, young adult, romance, contemporary, queer, fiction, lesbian"
The Facts Speak for Themselves,"young adult, , fiction, realistic fiction, teen, "
yolo (Internet Girls Series),"young adult, fiction, realistic fiction, contemporary, chick lit, romance, teen"
Gravity,"lgbt, young adult, queer, fiction, judaism, religion, realistic fiction"
Let the Children March,"picture books, historical, childrens, african american, social, historical, cultural"
The Watcher's Test (Deadendia Series),"graphic novel, fantasy, lgbt, comic book, young adult, queer, horror"
Lailah's Lunchbox: A Ramadan Story,"picture books, childrens, muslims, cultural, religion, holiday, realistic fiction"
Cool for the Summer,"romance, lgbt, young adult, contemporary, lesbian, queer, fiction"
How to Love,"romance, young adult, contemporary, new adult, fiction, realistic fiction, young adult"
Radiant Child: The Story of Young Artist Jean-Michel Basquiat,"picture books, biography, art, non-fiction, childrens, african american, biography"
Hidden Figures: The True Story of Four Black Women and the Space Race,"non-fiction, historical, science, biography, audiobook, feminism, historical"
The Meaning of Birds,"lgbt, young adult, contemporary, romance, queer, lesbian, fiction"
Girl on the Line,"mental health, young adult, contemporary, fiction, lgbt, romance, queer"
Unstoppable: How Jim Thorpe and the Carlisle Indian School Football Team Defeated Army (Encounter: Narrative Nonfiction Picture Books Series),"biography, sports, picture books, non-fiction, historical, native american, childrens"
Seeing Gender: An Illustrated Guide to Identity and Expression,"non-fiction, lgbt, queer, gender, graphic novel, feminism, transgender"
Faces at the Bottom of the Well: The Permanence of Racism,"race, non-fiction, historical, politics, social, african american, social"
Campfire Stories (Desmond Cole Ghost Patrol Series),"chapter books, childrens, humor"
33 Snowfish,"young adult, fiction, , realistic fiction, teen, contemporary, "
Mexican Whiteboy,"young adult, sports, realistic fiction, fiction, contemporary, cultural, baseball"
On Mother's Lap,"picture books, family, childrens, fiction, cultural, storytime, realistic fiction"
The Undefeated,"picture books, poetry, historical, non-fiction, childrens, african american, biography"
Modern Romance: An Investigation,"non-fiction, humor, audiobook, romance, comedy, social, psychology"
Lair of Dreams (The Diviners Series),"fantasy, young adult, historical, paranormal, audiobook, mystery, historical"
Lawn Boy,", fiction, lgbt, young adult, audiobook, contemporary, coming of age"
Neanderthal Opens the Door to the Universe,"young adult, contemporary, realistic fiction, humor, lgbt, fiction, romance"
Let it Snow: Three Holiday Romances,"young adult, romance, contemporary, christmas, fiction, short stories, holiday"
Eclipse (Twilight Series),"fantasy, young adult, romance, vampires, fiction, paranormal, paranormal"
Lola Gets a Cat (Lola Series),"picture books, cats, animals, childrens, storytime, fiction, african american"
When Angels Sing: The Story of Rock Legend Carlos Santana,"picture books, biography, music, non-fiction, childrens, cultural, historical"
Jaya and Rasa: A Love Story,"romance, young adult, contemporary, lgbt, queer, fiction, transgender"
The Downstairs Girl,"historical, young adult, historical, fiction, audiobook, romance, asia"
Stay Gold,"lgbt, young adult, romance, contemporary, queer, audiobook, fiction"
Rethinking Normal: A Memoir in Transition,"lgbt, non-fiction, memoir, transgender, queer, biography, biography"
Our Class is a Family,"picture books, school, childrens, family, realistic fiction, school, fiction"
Who Is the Dalai Lama? (Who was...? Series),"non-fiction, biography, historical, childrens, buddhism, religion, india"
The People Shall Continue,"picture books, historical, non-fiction, native american, childrens, indigenous, cultural"
Who Was Frida Kahlo? (Who was...? Series),"non-fiction, biography, art, historical, childrens, middle grade, audiobook"
Transgender Rights and Protections,young adult
Into the Real,"lgbt, young adult, fantasy, queer, science fiction, transgender, dystopia"
Lola Levine and the Vacation Dream (Lola Levine Series),"chapter books, childrens, family, , realistic fiction, travel, cultural"
This Book Is Gay,"non-fiction, lgbt, , queer, gay, self help, humor"
How Many Stars in the Sky?,"family, picture books, realistic fiction, science, astronomy, space, african american"
Be Dazzled,"young adult, romance, contemporary, lgbt, queer, fiction, audiobook"
Virgie Goes to School with Us Boys,"picture books, historical, african american, childrens, elementary, cultural, historical"
WeirDo Series: Tasty Weird!,childrens
Last Stop on Market Street,"picture books, childrens, realistic fiction, family, fiction, cultural, african american"
The Rough-Face Girl,"picture books, childrens, fairy tales, native american, fantasy, fiction, folklore"
The Sin-Eater's Confession,"young adult, mystery, lgbt, realistic fiction, fiction, contemporary, teen"
The Skin You Live In,"picture books, childrens, cultural, race, poetry, storytime, non-fiction"
Gold Wings Rising (Skybound Series),"fantasy, young adult, lgbt, queer, fiction, young adult, high fantasy"
The Barren Grounds (The Misewa Saga Series),"fantasy, middle grade, indigenous, fiction, young adult, canada, adventure"
What We Saw,"young adult, contemporary, mystery, realistic fiction, fiction, romance, abuse"
Baseball Saved Us,"historical, picture books, sports, childrens, baseball, cultural, world war ii"
Those Shoes,"picture books, childrens, realistic fiction, poverty, fiction, school, cultural"
The Gods of Tango,"historical, fiction, lgbt, queer, historical, music, romance"
Influence,"mystery, young adult, contemporary, romance, thriller, mystery, fiction"
The Tyrant’s Tomb (The Trials of Apollo Series),"fantasy, mythology, young adult, middle grade, fiction, greek mythology, adventure"
Forever...,"young adult, romance, fiction, contemporary, , teen, classics"
The Carnival at Bray,"young adult, historical, romance, coming of age, fiction, realistic fiction, music"
No Ashes in the Fire: Coming of Age Black and Free in America,"memoir, non-fiction, lgbt, race, social, queer, biography"
Fairest: Levana's Story (The Lunar Chronicles Series),"fantasy, young adult, science fiction, retellings, dystopia, fiction, romance"
Between Shades of Gray,"historical, young adult, fiction, historical, war, world war ii, audiobook"
Breathless,"romance, young adult, contemporary, fiction, realistic fiction, coming of age, young adult"
Hachiko: The True Story of a Loyal Dog,"picture books, dogs, japan, animals, non-fiction, childrens, asia"
Destined (House of Night Series),"young adult, vampires, fantasy, paranormal, romance, supernatural, fiction"
Darius the Great Is Not Okay (Darius the Great Series),"young adult, contemporary, lgbt, fiction, mental health, queer, realistic fiction"
Ramona Blue,"young adult, lgbt, contemporary, romance, queer, fiction, audiobook"
Not So Pure and Simple,"young adult, contemporary, romance, fiction, realistic fiction, audiobook, feminism"
The Girls I've Been,"young adult, thriller, lgbt, mystery, contemporary, fiction, lesbian"
Bright World (The Hazards of Love Series),"graphic novel, fantasy, lgbt, young adult, queer, comic book, romance"
Wayward Witch (Brooklyn Brujas Series),"fantasy, young adult, witches, magic, paranormal, fiction, urban"
The Berlin Boxing Club,"historical, young adult, fiction, historical, sports, world war ii, holocaust"
The Five Stages of Andrew Brawley,"young adult, lgbt, contemporary, romance, queer, fiction, mental health"
Trail of Crumbs,"young adult, contemporary, realistic fiction, canada, retellings, fiction, teen"
Fragile Remedy,"lgbt, young adult, science fiction, fantasy, dystopia, queer, romance"
Wilma's Way Home: The Life of Wilma Mankiller,"biography, picture books, non-fiction, historical, indigenous, childrens, native american"
Bayou Magic (The Louisiana Girls Trilogy Series),"middle grade, fantasy, magic, fiction, mermaids, childrens, african american"
Dear Martin,"young adult, contemporary, fiction, realistic fiction, audiobook, race, social"
Pulp,"historical, lgbt, young adult, historical, fiction, queer, contemporary"
Lord of the Flies,"fiction, classics, young adult, school, dystopia, , school"
The You I've Never Known,"young adult, poetry, lgbt, contemporary, realistic fiction, fiction, audiobook"
Crown of Feathers (Crown of Feathers Series),"fantasy, young adult, young adult, fiction, romance, high fantasy, audiobook"
Dope Sick,"young adult, fiction, african american, realistic fiction, magic, urban, fantasy"
Teaching Truly: A Curriculum to Indigenize Mainstream Education,"education, teaching, non-fiction"
The Best at It,"middle grade, lgbt, realistic fiction, fiction, contemporary, queer, audiobook"
Ash,"fantasy, young adult, lgbt, romance, queer, fiction, retellings"
Vol. 4 (Blue Flag Series),"manga, lgbt, romance, contemporary, comic book, young adult, queer"
A ​Court of Silver Flames (A Court of Thorns and Roses Series),"fantasy, romance, romance, fiction, fae, fantasy, audiobook"
I Am Every Good Thing,"picture books, childrens, poetry, african american, realistic fiction, fiction, cultural"
Julián at the Wedding (Julián Series),"picture books, lgbt, childrens, queer, realistic fiction, family, love"
Who Is Michelle Obama? (Who was...? Series),"biography, non-fiction, historical, childrens, biography, education, african american"
Totally Joe (The Misfits Series),"young adult, lgbt, fiction, realistic fiction, queer, middle grade, teen"
Victor and Nora: A Gotham Love Story,"graphic novel, romance, young adult, comic book, comic book, superheroes, graphic novel"
They Both Die at the End,"romance, young adult, lgbt, fiction, contemporary, queer, audiobook"
Annie on My Mind,"lgbt, young adult, romance, queer, fiction, lesbian, classics"
I Am Alfonso Jones,"graphic novel, young adult, fiction, realistic fiction, comic book, contemporary, social"
Out of Darkness,"historical, young adult, , fiction, historical, romance, audiobook"
Esta bien ser diferente/It's Okay to Be Different (Spanish Version),"picture books, childrens, lgbt, cultural, fiction, storytime, family"
A Peacock Among Pigeons,"picture books, lgbt, childrens, realistic fiction"
Darkness Before Dawn,"young adult, realistic fiction, fiction, african american, contemporary, middle grade, teen"
The Boy in the Dress,"fiction, childrens, middle grade, humor, lgbt, young adult, contemporary"
Great,"young adult, retellings, contemporary, fiction, lgbt, romance, realistic fiction"
My Name Is Sally Little Song,"historical, middle grade, historical, fiction, native american, childrens, juvenile"
The Girls Are Never Gone,"horror, young adult, paranormal, lgbt, lesbian, mystery, fantasy"
Alex As Well,"lgbt, young adult, contemporary, realistic fiction, queer, fiction, intersex"
The Color of My Words,"young adult, middle grade, fiction, realistic fiction, historical, spain, cultural"
A Perfect Blank,"young adult, poetry, science fiction, teen"
The ABC's of LGBT+,"non-fiction, lgbt, queer, gender, social, transgender, sexuality"
Gordon Parks: How the Photographer Captured Black and White America,"picture books, biography, non-fiction, photography, historical, childrens, art"
