Title,Mapped Genres
Eagle Song,"native american, childrens, fiction, middle grade, realistic fiction, school, cultural"
Early Humans,"historical, science, non-fiction, childrens, anthropology, prehistoric, prehistoric"
Early Sunday Morning,"picture books, childrens, family, religion, fiction, music, cultural"
Earth (the book) A Visitors Guide to the Human Race,"humor, non-fiction, comedy, audiobook, politics, historical, science"
Eclipse (Twilight Series),"fantasy, young adult, romance, vampires, fiction, paranormal, paranormal"
Eden West,"young adult, cults, realistic fiction, contemporary, religion, fiction, cult classics"
Edie in Between,"fantasy, young adult, lgbt, lesbian, witches, contemporary, fiction"
El Día En Que Descubres Quién Eres,"picture books, childrens, realistic fiction, school, fiction, cultural, african american"
El Sol Y Sus Flores,"poetry, feminism, non-fiction, contemporary, adult, romance, mental health"
Elevation,"fiction, horror, fantasy, audiobook, short stories, mystery, novella"
Elevation,"fiction, horror, fantasy, audiobook, short stories, mystery, novella"
Elton John,"picture books, non-fiction, biography, music, childrens, lgbt, historical"
Ember Queen,"fantasy, young adult, romance, young adult, fiction, magic, audiobook"
Emergency Contact,"romance, young adult, contemporary, fiction, new adult, audiobook, realistic fiction"
Empire of Storms (Throne of Glass Series),"fantasy, young adult, romance, fae, fiction, new adult, romance"
Empire of Wild,"horror, fantasy, fiction, indigenous, canada, mystery, audiobook"
Empress of the World (Battle Hall Davies Series),"young adult, lgbt, romance, fiction, queer, lesbian, contemporary"
Empty,"young adult, realistic fiction, contemporary, mental health, fiction, mental health, abuse"
En el bosque,"young adult, teen, fiction, spain, mystery"
Encounter,"historical, picture books, cultural, native american, childrens, historical, american"
End of Watch,"horror, fiction, thriller, mystery, crime, audiobook, mystery"
Endangered (LG),"mystery, young adult, contemporary, thriller, high school, suspense, mystery"
Ender's Shadow,"science fiction, fiction, young adult, fantasy, science fiction, audiobook, space"
Enough! 20 Protesters Who Changed America,"picture books, non-fiction, social, historical, childrens, activism, biography"
Envy,"historical, young adult, romance, historical, fiction, historical, chick lit"
Eon: Dragoneye Reborn,"fantasy, young adult, dragons, magic, fiction, young adult, high fantasy"
Eona: The Last Dragoneye,"fantasy, young adult, dragons, romance, magic, fiction, high fantasy"
Equus,"plays, drama, fiction, classics, theatre, school, psychology"
Escape,"non-fiction, memoir, biography, religion, cults, biography, autobiography"
Escape from the Roller Ghoster (Desmond Cole Ghost Patrol Series),"chapter books, humor"
Escape the Mask,"fantasy, young adult, dystopia, childrens"
Esperanza Rising,"historical, middle grade, young adult, fiction, childrens, school, historical"
Esta bien ser diferente/It's Okay to Be Different (Spanish Version),"picture books, childrens, lgbt, cultural, fiction, storytime, family"
Evermore,"young adult, fantasy, paranormal, romance, paranormal, fiction, supernatural"
Every Dog in the Neighborhood,"picture books, dogs, animals, childrens, fiction, realistic fiction, humor"
Every Heart a Doorway (Seanan McGuire Series),"fantasy, young adult, fiction, mystery, audiobook, lgbt, novella"
Every Hidden Thing,"young adult, historical, romance, historical, adventure, fiction, teen"
Everybody Sees the Ants,"young adult, contemporary, magic, fiction, realistic fiction, fantasy, teen"
Everyday Antiracism: Getting Real About Race in School,"education, non-fiction, race, social, teaching, anti racist, grad school"
Everything Everything,"young adult, romance, contemporary, fiction, realistic fiction, audiobook, young adult"
Everything Mythology,"mythology, childrens, non-fiction, historical, juvenile"
Everything You Love Will Burn: Inside the Rebirth of White Nationalism in America,"non-fiction, politics, historical, race, audiobook, social, american"
Everywhere Babies,"picture books, childrens, , family, fiction, lgbt, kids"
Evil Queen,"fantasy, young adult, retellings, romance, young adult, magic, fiction"
Excelsior!: The Amazing Life of Stan Lee,"biography, non-fiction, comic book, autobiography, memoir, biography, historical"
Exquisite: The Poetry and Life of Gwendolyn Brooks,"picture books, poetry, biography, non-fiction, childrens, historical, african american"
Extra Credit,"realistic fiction, middle grade, fiction, childrens, school, juvenile, contemporary"
Extremely Loud and Incredibly Close,"fiction, historical, contemporary, , literary fiction, adult, adult"
Fable,"fantasy, young adult, romance, pirates, young adult, fiction, audiobook"
Faces at the Bottom of the Well: The Permanence of Racism,"race, non-fiction, historical, politics, social, african american, social"
Fade,"young adult, fantasy, paranormal, romance, fiction, mystery, supernatural"
Fair Weather,"historical, young adult, fiction, middle grade, childrens, historical, humor"
Fairest: Levana's Story (The Lunar Chronicles Series),"fantasy, young adult, science fiction, retellings, dystopia, fiction, romance"
Faith Ringgold (Getting to Know the World's Greatest Artists),"art, biography, picture books, african american"
Falling Hard: 100 Love Poems by Teenagers,"poetry, young adult, romance, teen, anthology"
Falling into Place,"young adult, contemporary, fiction, mental health, realistic fiction, young adult, mental health"
Fallout,"young adult, poetry, fiction, contemporary, realistic fiction, mental health, teen"
Fallout (Crank Series),"young adult, poetry, fiction, contemporary, realistic fiction, mental health, teen"
Family of Liars: The Prequel to We Were Liars,"young adult, mystery, fiction, thriller, contemporary, mystery, audiobook"
Fan Art,"lgbt, young adult, contemporary, romance, fiction, realistic fiction, queer"
Fancy White Trash,"young adult, romance, realistic fiction, contemporary, teen, humor, fiction"
Fangirl,"young adult, contemporary, fiction, realistic fiction, new adult, audiobook, coming of age"
Fans of the Impossible Life,"young adult, lgbt, contemporary, mental health, romance, fiction, queer"
Far from Xanadu,"lgbt, young adult, fiction, queer, romance, lesbian, contemporary"
Far from You,"young adult, mystery, lgbt, contemporary, romance, lesbian, thriller"
Far from the Tree,"young adult, contemporary, fiction, audiobook, realistic fiction, lgbt, family"
Far from the Tree: How Children and Their Parents Learn to Accept One Another . . . Our Differences Unite Us,"non-fiction, psychology, parenting, science, social, disability, mental health"
Fat Kid Rules the World,"young adult, realistic fiction, fiction, music, teen, audiobook, humor"
Fatal Tide,"mystery, fiction, suspense, romance, thriller, romance, mystery"
Fates and Furies,"fiction, contemporary, literary fiction, audiobook, romance, adult, adult"
Fatty Legs: A True Story,"non-fiction, memoir, indigenous, middle grade, canada, biography, historical"
Fault Line,"young adult, fiction, realistic fiction, abuse, romance, teen, young adult"
Fealess Fourteen,"mystery, fiction, humor, chick lit, romance, crime, audiobook"
Feeling Wrong in Your Own Body: Understanding What It Means to Be Transgender,"non-fiction, lgbt, queer, transgender"
Fence: Rivals,"graphic novel, lgbt, young adult, contemporary, sports, queer, romance"
Fences,"plays, drama, classics, school, fiction, school, historical"
Feral Youth,"young adult, short stories, contemporary, anthology, lgbt, fiction, retellings"
Festival of Colors,"picture books, holiday, childrens, india, cultural, storytime, realistic fiction"
Fever Crumb,"steampunk, young adult, fantasy, science fiction, fiction, dystopia, teen"
Fifteen Hundred Miles from the Sun,"lgbt, romance, young adult, contemporary, queer, fiction, gay"
Fifty Shades Darker,"romance, fiction, erotica, bdsm, adult, contemporary, contemporary"
Fifty Shades of Grey,"fiction, erotica, bdsm, adult, contemporary, contemporary, chick lit"
Fighting Words,"middle grade, realistic fiction, fiction, young adult, abuse, mental health, contemporary"
Final Appeal,"mystery, fiction, thriller, law, mystery, suspense, crime"
Finders Keepers,"horror, fiction, thriller, mystery, crime, audiobook, mystery"
Finding Community,lgbt
Finding Junie Kim,"middle grade, historical, realistic fiction, fiction, contemporary, historical, war"
Finding Yvonne,"contemporary, young adult, romance, realistic fiction, fiction, young adult, audiobook"
Finger Lickin Fifteen,"mystery, fiction, humor, chick lit, romance, crime, audiobook"
Fire,"fantasy, young adult, romance, fiction, young adult, adventure, magic"
Fire Song,"young adult, lgbt, fiction, contemporary, indigenous, queer, teen"
Firefight,"fantasy, young adult, science fiction, fiction, dystopia, audiobook, urban"
Firestarter (SK),"horror, fiction, thriller, science fiction, fantasy, paranormal, suspense"
Fishing Day,"picture books, historical, childrens, african american"
Fishtailing,"poetry, young adult, canada, realistic fiction, teen, high school, fiction"
Five Dark Fates,"fantasy, young adult, young adult, audiobook, fiction, magic, romance"
Flame in the Mist,"fantasy, young adult, romance, retellings, historical, young adult, fiction"
Flamer,"graphic novel, lgbt, young adult, , queer, fiction, comic book"
Flawless,"young adult, mystery, fiction, contemporary, romance, chick lit, thriller"
Flawless (Pretty Little Liars Series),"young adult, mystery, fiction, contemporary, romance, chick lit, thriller"
Flip,"young adult, fantasy, paranormal, science fiction, mystery, teen, fiction"
Flirtin' With the Monster: Your Favorite Authors on Ellen Hopkins' Crank and Glass,"non-fiction, poetry, short stories, teen, realistic fiction, contemporary, high school"
Fly Away,"fiction, chick lit, audiobook, contemporary, romance, adult, drama"
Flying the Dragon,"middle grade, realistic fiction, fiction, family, childrens, cultural, young adult"
Follow Your Arrow,"lgbt, romance, young adult, contemporary, queer, fiction, lesbian"
For Real,"young adult, contemporary, romance, chick lit, road trip, fiction, travel"
For White Folks Who Teach in the Hood... and the Rest of Y'all Too: Reality Pedagogy and Urban Education,"education, non-fiction, teaching, social, race, anti racist, school"
For the Wolf,"fantasy, romance, retellings, young adult, fiction, magic, adult"
Forever (MS),"young adult, fantasy, romance, paranormal, werewolves, fiction, paranormal"
Forever for a Year,"young adult, romance, contemporary, fiction, teen, realistic fiction, "
Forever...,"young adult, romance, fiction, contemporary, , teen, classics"
Forget This Ever Happened,"young adult, science fiction, lgbt, historical, queer, horror, mystery"
Forging the Darksword,"fantasy, fiction, science fiction, high fantasy, magic, epic, dragons"
Four Past Midnight,"horror, fiction, short stories, thriller, fantasy, mystery, suspense"
Fourth Wing,"romance, dragons, fiction, audiobook, enemies to lovers, fantasy, magic"
Fragile Eternity,"fantasy, young adult, paranormal, romance, urban, fae, fae"
Fragile Remedy,"lgbt, young adult, science fiction, fantasy, dystopia, queer, romance"
Frankie and Bug,"middle grade, lgbt, historical, realistic fiction, audiobook, fiction, historical"
Freak Show,"young adult, fiction, lgbt, queer, humor, teen, romance"
Freak the Mighty,"young adult, realistic fiction, fiction, middle grade, school, childrens, school"
Freakboy,"young adult, lgbt, poetry, contemporary, realistic fiction, fiction, queer"
Freaks and Revelations,"young adult, lgbt, fiction, queer, realistic fiction, gay, adult"
Freedom in Congo Square,"picture books, historical, poetry, childrens, african american, historical, music"
Freshman Promises,"romance, fiction, young adult"
Friction,"young adult, realistic fiction, abuse, contemporary, fiction, teen, coming of age"
Friday,"science fiction, fiction, science fiction, fiction, fantasy, adventure, audiobook"
Friday I'm in Love,"romance, young adult, lgbt, queer, contemporary, lesbian, fiction"
Friends Forever,"graphic novel, middle grade, memoir, mental health, comic book, realistic fiction, childrens"
From Ashes,"new adult, romance, contemporary, young adult, college, contemporary, abuse"
From a Buick 8,"horror, fiction, fantasy, thriller, science fiction, mystery, supernatural"
From the Stars in the Sky to the Fish in the Sea,"picture books, lgbt, childrens, queer, fiction, gender, transgender"
Front Desk,"middle grade, realistic fiction, fiction, childrens, audiobook, historical, contemporary"
Front Lines,"historical, young adult, historical, war, fiction, alternate history, world war ii"
Fry Bread: A Native American Family Story,"picture books, childrens, food, native american, indigenous, family, historical"
Full Disclosure,"young adult, contemporary, lgbt, romance, fiction, queer, audiobook"
Full House,"romance, mystery, chick lit, fiction, humor, contemporary, contemporary"
Furyborn,"fantasy, young adult, young adult, romance, fiction, high fantasy, magic"
GLBT Teens and Society,young adult
GLBTQ*: The Survival Guide for Queer and Questioning Teens,"lgbt, young adult, teen, gender, gay, transgender, sexuality"
Game Changer,"young adult, science fiction, fantasy, fiction, audiobook, contemporary, lgbt"
Gates of Paradise,"young adult, vampires, fantasy, paranormal, romance, angels, supernatural"
Gay Believers: Homosexuality and Religion,non-fiction
Gearbreakers (Gearbreakers Series),"science fiction, lesbian, lgbt, young adult, queer, fantasy, romance"
Gears of War,"comic book, graphic novel, video games, games, science fiction"
Geektastic: Stories from the Nerd Herd,"short stories, young adult, fiction, anthology, contemporary, humor, fantasy"
Gender Identity: Beyond Pronouns and Bathrooms,"non-fiction, lgbt, historical, middle grade, teen"
Gender Identity: The Search for Self,lgbt
Gender Queer: A Memoir,"graphic novel, lgbt, memoir, non-fiction, queer, comic book, "
Genesis Begins Again,"middle grade, realistic fiction, young adult, fiction, contemporary, african american, family"
Genuine Fraud,"young adult, mystery, thriller, contemporary, fiction, mystery, audiobook"
Geography Club,"young adult, lgbt, fiction, queer, contemporary, gay, romance"
Georgia Peaches and Other Forbidden Fruit,"lgbt, young adult, romance, contemporary, queer, fiction, lesbian"
Gerald's Game,"horror, fiction, thriller, suspense, mystery, audiobook, adult"
Gertrude and Claudius,"fiction, historical, historical, , american, literary fiction, "
Get a Clue (Bookish Boyfriends Series),"romance, young adult, lgbt, mystery, contemporary, fiction, retellings"
Getting It,"young adult, lgbt, fiction, gay, contemporary, teen, realistic fiction"
Ghost Boys,"middle grade, young adult, fiction, realistic fiction, historical, contemporary, social"
Ghost Boys,"middle grade, young adult, fiction, realistic fiction, historical, contemporary, social"
Ghost Wood Song,"fantasy, young adult, horror, lgbt, paranormal, mystery, queer"
Ghosts in the Schoolyard: Racism and School Closings on Chicago's South Side,"non-fiction, education, race, historical, politics, social, social"
Ghouls Just Want to Have Fun (Desmond Cole Ghost Patrol Series),"chapter books, humor"
Giants,non-fiction
Gideon the Ninth (The Locked Tomb Series),"fantasy, science fiction, fiction, lgbt, queer, horror, audiobook"
Gilded,"fantasy, young adult, retellings, romance, audiobook, fiction, young adult"
Gingerbread (Cyd Charisse Series),"young adult, fiction, contemporary, teen, romance, realistic fiction, chick lit"
Girl Crushed,"lgbt, romance, young adult, contemporary, queer, fiction, lesbian"
Girl Gone Viral,"young adult, science fiction, contemporary, mystery, fiction, fantasy, thriller"
Girl Made of Stars,"young adult, contemporary, lgbt, fiction, queer, romance, lesbian"
Girl Online: The First Novel by Zoella,"young adult, romance, contemporary, fiction, chick lit, young adult, mental health"
Girl With a Pearl Earring,"historical, fiction, classics, historical, art, romance, adult"
Girl on the Line,"mental health, young adult, contemporary, fiction, lgbt, romance, queer"
Girlchild,"fiction, young adult, adult, coming of age, contemporary, adult, realistic fiction"
Girls In Pants: The Third Summer Of The Sisterhood,"young adult, fiction, chick lit, contemporary, romance, teen, realistic fiction"
Girls Like Us (2015),"young adult, realistic fiction, fiction, teen, contemporary, disability, coming of age"
Girls Like Us (2019),"mystery, thriller, fiction, mystery, suspense, audiobook, crime"
Girls at the Edge of the World,"fantasy, lgbt, lesbian, young adult, romance, queer, science fiction"
Girls vs. Guys: Surprising Differences Between the Sexes,non-fiction
Glass,"young adult, poetry, fiction, contemporary, realistic fiction, mental health, teen"
Glass (Crank Series),"young adult, poetry, fiction, contemporary, realistic fiction, , mental health"
Glass Sword,"young adult, dystopia, romance, fiction, young adult, audiobook, magic"
Glimpse: A YA Paranormal Romance,"young adult, paranormal, fantasy, romance, paranormal, supernatural, fiction"
Glory O'Brien's History of the Future,"young adult, magic, fantasy, contemporary, fiction, science fiction, teen"
Gnomon,"science fiction, fiction, dystopia, mystery, fantasy, science fiction, cyberpunk"
Goat Girls: Two Weetzie Bat Books,"young adult, fiction, fantasy, magic, romance, urban, magic"
God Emperor of Dune,"science fiction, fiction, fantasy, science fiction, classics, audiobook, space"
Goddess Interrupted,"mythology, young adult, fantasy, romance, paranormal, greek mythology, fiction"
Gods and Monsters,"fantasy, romance, young adult, witches, audiobook, young adult, romance"
Going Down Home with Daddy,"picture books, family, childrens, african american, realistic fiction, fiction, cultural"
Going Viral: A Socially Distant Love Story,"romance, lgbt, young adult, realistic fiction, fiction, queer, contemporary"
Gold Wings Rising (Skybound Series),"fantasy, young adult, lgbt, queer, fiction, young adult, high fantasy"
Golden Boy,"fiction, young adult, lgbt, contemporary, queer, coming of age, adult"
Gone Girl,"fiction, mystery, thriller, mystery, crime, suspense, contemporary"
Good Girls,"young adult, romance, contemporary, chick lit, fiction, teen, realistic fiction"
Good Idea,"mystery, young adult, fiction, thriller, lgbt, mystery, audiobook"
Good Trouble: Lessons from the Civil Rights Playbook,"non-fiction, historical, politics, graphic novel, , audiobook, race"
Gordon Parks: How the Photographer Captured Black and White America,"picture books, biography, non-fiction, photography, historical, childrens, art"
Gossip Girl: A Novel by Cecily von Ziegesar (Gossip Girl Series),"young adult, fiction, chick lit, contemporary, romance, teen, drama"
Grace and Glory,"fantasy, romance, paranormal, young adult, audiobook, urban, angels"
Gracefully Grayson,"lgbt, middle grade, young adult, realistic fiction, fiction, contemporary, queer"
Grandfather Tang's Story,"mathematics, picture books, childrens, china, animals, family, asia"
Grasshopper Jungle (Grasshopper Jungle Series),"young adult, science fiction, lgbt, fiction, horror, humor, fantasy"
Grave Mercy,"fantasy, young adult, historical, romance, historical, fiction, young adult"
Grave Peril,"fantasy, urban, mystery, fiction, audiobook, paranormal, magic"
Gravity,"lgbt, young adult, queer, fiction, judaism, religion, realistic fiction"
Great,"young adult, retellings, contemporary, fiction, lgbt, romance, realistic fiction"
Grim Lovelies,"fantasy, young adult, young adult, witches, magic, fiction, urban"
Grit,"young adult, contemporary, mystery, fiction, realistic fiction, thriller, mystery"
Guardian (JL),"historical, young adult, historical, african american, teen, realistic fiction, fiction"
Guardian (Proxy Series),"young adult, lgbt, science fiction, dystopia, fiction, queer, romance"
Hachiko: The True Story of a Loyal Dog,"picture books, dogs, japan, animals, non-fiction, childrens, asia"
Hades,"angels, young adult, fantasy, romance, paranormal, paranormal, demons"
Hair Love,"picture books, childrens, family, african american, realistic fiction, fiction, cultural"
Half Lost,"fantasy, young adult, lgbt, magic, fiction, paranormal, witches"
Half of a Yellow Sun,"fiction, historical, nigeria, war, historical, africa, "
Handcuffs,"young adult, romance, contemporary, realistic fiction, teen, young adult, fiction"
Handle with Care,"fiction, contemporary, chick lit, drama, adult, adult, realistic fiction"
Hands Up!,"picture books, childrens, african american, storytime, fiction, social, family"
Hank's Big Day: The Story of a Bug,"picture books, childrens, storytime, animals, fiction, adventure, nature"
Happiness Sold Separately,"fiction, chick lit, romance, contemporary, audiobook, adult, adult"
Happy families,"young adult, lgbt, realistic fiction, fiction, queer, family, transgender"
Harlem's Little Blackbird: The Story of Florence Mills,"picture books, biography, non-fiction, music, childrens, african american, historical"
Harrow Lake,"horror, young adult, mystery, thriller, fiction, mystery, contemporary"
Harvesting Hope: The Story of Cesar Chavez,"picture books, biography, non-fiction, childrens, historical, cultural, social"
Haunted,"horror, fiction, short stories, contemporary, thriller, dark, adult"
Head Above Water,"young adult, fiction"
Hear These Voices: Youth at the Edge of the Millennium,", non-fiction"
Heart of Flames (Crown of Feathers Series),"fantasy, young adult, young adult, romance, audiobook, lgbt, fiction"
Heart of Stone,"urban, fantasy, paranormal, romance, vampires, fiction, paranormal"
Heartbreak Boys,"romance, lgbt, young adult, queer, contemporary, gay, fiction"
Heartstopper: Volume One (Heartstopper Series),"graphic novel, young adult, lgbt, queer, contemporary, comic book, fiction"
Heartstopper: Volume Three (Heartstopper Series),"graphic novel, lgbt, young adult, queer, contemporary, comic book, fiction"
Heartstopper: Volume Two (Heartstopper Series),"graphic novel, lgbt, young adult, queer, contemporary, comic book, fiction"
Heartwishes,"romance, contemporary, fiction, contemporary, mystery, adult, fantasy"
Heaven's Prisoners,"mystery, fiction, crime, thriller, mystery, detective, noir"
Heavy: An American Memoir,"memoir, non-fiction, race, audiobook, biography, biography, anti racist"
Hector's Hiccups (Sofía Martínez Series),"chapter books, picture books, family, childrens, spain"
Heiress Apparently (Daughters of the Dynasty Series),"young adult, romance, contemporary, fiction, young adult, audiobook, mystery"
Helen of Troy,"historical, mythology, fiction, historical, greek mythology, romance, fantasy"
Hello Now,"young adult, fantasy, lgbt, romance, contemporary, audiobook, queer"
Helter Skelter: The True Story of the Manson Murders,"true crime, non-fiction, crime, historical, horror, biography, audiobook"
Henry Aaron's Dream,"picture books, biography, non-fiction, sports, baseball, historical, african american"
Henry's Freedom Box: A True Story from the Underground Railroad,"picture books, historical, childrens, cultural, historical, african american, family"
Her Royal Highness,"romance, lgbt, young adult, contemporary, lesbian, queer, fiction"
Her Royal Highness (Royals Series),"romance, lgbt, young adult, contemporary, lesbian, queer, fiction"
Here Comes Santa Claus,"romance, christmas, contemporary, contemporary, holiday, anthology, fiction"
Here the Whole Time,"romance, lgbt, young adult, queer, contemporary, fiction, gay"
Here's to Us,"romance, lgbt, young adult, contemporary, queer, fiction, audiobook"
Heretics of Dune,"science fiction, fiction, fantasy, science fiction, classics, audiobook, space"
Heroes,"young adult, historical, fiction, school, war, historical, classics"
Hexed,"young adult, fantasy, paranormal, witches, romance, magic, supernatural"
Hey Black Child,"picture books, poetry, childrens, african american, cultural, race, fiction"
Hiawatha and the Peacemaker,"picture books, native american, indigenous, historical, childrens, non-fiction, biography"
Hidden (House of Night Series),"fantasy, young adult, vampires, paranormal, romance, fiction, supernatural"
Hidden Figures: The True Story of Four Black Women and the Space Race,"non-fiction, historical, science, biography, audiobook, feminism, historical"
High School,"memoir, non-fiction, lgbt, music, queer, audiobook, biography"
Highly Illogical Behavior,"young adult, contemporary, mental health, lgbt, fiction, realistic fiction, mental health"
History Is All You Left Me,"young adult, contemporary, lgbt, romance, queer, fiction, mental health"
Hold Back the Tide,"horror, fantasy, young adult, mystery, thriller, historical, paranormal"
Hold Still,"young adult, contemporary, mental health, fiction, realistic fiction, lgbt, romance"
Home,"mystery, fiction, thriller, crime, suspense, mystery, audiobook"
Home After Dark,"graphic novel, comic book, fiction, young adult, coming of age, historical, graphic novel"
Home of the Brave: 15 Immigrants Who Shaped U.S. History,"childrens, non-fiction, historical, biography, middle grade"
Homecoming (Fat Angie Series),"young adult, romance, lgbt, fiction"
Homegoing,"historical, fiction, historical, literary fiction, audiobook, race, adult"
Honestly Ben,"young adult, lgbt, romance, contemporary, queer, audiobook, fiction"
Honeymoon,"mystery, fiction, thriller, crime, suspense, mystery, audiobook"
Hooked,"young adult, romance, fiction, realistic fiction, high school, young adult, teen"
Hoop City: Chicago,"sports, young adult, realistic fiction"
Hoop City: Detroit,"sports, young adult"
Hooper,"sports, young adult, realistic fiction, contemporary, fiction, basketball, teen"
Hoot,"young adult, fiction, middle grade, realistic fiction, childrens, mystery, animals"
