Title,Mapped Genres
Cinderella Is Dead,"fantasy, young adult, lgbt, romance, queer, retellings, lesbian"
Bowery Girl,"historical, young adult, historical, 19th century, fiction, young adult, teen"
The Magical Yet,"picture books, childrens, growth mindset, inspirational, storytime, fiction, fantasy"
Anger Is a Gift: A Novel,"young adult, contemporary, lgbt, fiction, queer, realistic fiction, mental health"
The Bridge,"young adult, lgbt, fiction, mental health, contemporary, realistic fiction, audiobook"
The Pants Project,"lgbt, middle grade, young adult, contemporary, realistic fiction, fiction, queer"
Out of the Easy,"historical, young adult, historical, fiction, mystery, romance, coming of age"
Pedagogy of the Oppressed,"education, non-fiction, philosophy, politics, theory, social, teaching"
Where We Go From Here,"lgbt, contemporary, young adult, queer, fiction, romance, audiobook"
One of Those Hideous Books Where the Mother Dies,"young adult, poetry, realistic fiction, contemporary, fiction, teen, high school"
Draw Me a Star,"picture books, childrens, , art, fiction, space, nature"
The Ultimate Guys' Body Book: Not-So-Stupid Questions About Your Body,"science, parenting, childrens, health, family, non-fiction"
Black Youth Rising: Activism and Radical Healing in Urban America,"education, social, non-fiction, anti racist, race, activism"
Perfect (Impulse Series),"young adult, poetry, fiction, contemporary, realistic fiction, mental health, mental health"
Sofia's Party Shoes (Sofía Martínez Series),"childrens, spain, realistic fiction, chapter books"
Pink!,"picture books, childrens, fiction, animals, birds, family, emotion"
Bait,"young adult, fiction, abuse, lgbt, contemporary, realistic fiction, teen"
25 Women Who Dared to Go,historical
Tell Me Again How a Crush Should Feel,"lgbt, young adult, romance, contemporary, queer, fiction, lesbian"
The Facts Speak for Themselves,"young adult, , fiction, realistic fiction, teen, "
yolo (Internet Girls Series),"young adult, fiction, realistic fiction, contemporary, chick lit, romance, teen"
Gravity,"lgbt, young adult, queer, fiction, judaism, religion, realistic fiction"
Let the Children March,"picture books, historical, childrens, african american, social, historical, cultural"
The Watcher's Test (Deadendia Series),"graphic novel, fantasy, lgbt, comic book, young adult, queer, horror"
Lailah's Lunchbox: A Ramadan Story,"picture books, childrens, muslims, cultural, religion, holiday, realistic fiction"
Cool for the Summer,"romance, lgbt, young adult, contemporary, lesbian, queer, fiction"
How to Love,"romance, young adult, contemporary, new adult, fiction, realistic fiction, young adult"
Radiant Child: The Story of Young Artist Jean-Michel Basquiat,"picture books, biography, art, non-fiction, childrens, african american, biography"
Hidden Figures: The True Story of Four Black Women and the Space Race,"non-fiction, historical, science, biography, audiobook, feminism, historical"
The Meaning of Birds,"lgbt, young adult, contemporary, romance, queer, lesbian, fiction"
Girl on the Line,"mental health, young adult, contemporary, fiction, lgbt, romance, queer"
Unstoppable: How Jim Thorpe and the Carlisle Indian School Football Team Defeated Army (Encounter: Narrative Nonfiction Picture Books Series),"biography, sports, picture books, non-fiction, historical, native american, childrens"
Seeing Gender: An Illustrated Guide to Identity and Expression,"non-fiction, lgbt, queer, gender, graphic novel, feminism, transgender"
Faces at the Bottom of the Well: The Permanence of Racism,"race, non-fiction, historical, politics, social, african american, social"
Campfire Stories (Desmond Cole Ghost Patrol Series),"chapter books, childrens, humor"
33 Snowfish,"young adult, fiction, , realistic fiction, teen, contemporary, "
Mexican Whiteboy,"young adult, sports, realistic fiction, fiction, contemporary, cultural, baseball"
On Mother's Lap,"picture books, family, childrens, fiction, cultural, storytime, realistic fiction"
The Undefeated,"picture books, poetry, historical, non-fiction, childrens, african american, biography"
Modern Romance: An Investigation,"non-fiction, humor, audiobook, romance, comedy, social, psychology"
Lair of Dreams (The Diviners Series),"fantasy, young adult, historical, paranormal, audiobook, mystery, historical"
Lawn Boy,", fiction, lgbt, young adult, audiobook, contemporary, coming of age"
Neanderthal Opens the Door to the Universe,"young adult, contemporary, realistic fiction, humor, lgbt, fiction, romance"
Let it Snow: Three Holiday Romances,"young adult, romance, contemporary, christmas, fiction, short stories, holiday"
Eclipse (Twilight Series),"fantasy, young adult, romance, vampires, fiction, paranormal, paranormal"
Lola Gets a Cat (Lola Series),"picture books, cats, animals, childrens, storytime, fiction, african american"
When Angels Sing: The Story of Rock Legend Carlos Santana,"picture books, biography, music, non-fiction, childrens, cultural, historical"
Jaya and Rasa: A Love Story,"romance, young adult, contemporary, lgbt, queer, fiction, transgender"
The Downstairs Girl,"historical, young adult, historical, fiction, audiobook, romance, asia"
Stay Gold,"lgbt, young adult, romance, contemporary, queer, audiobook, fiction"
Rethinking Normal: A Memoir in Transition,"lgbt, non-fiction, memoir, transgender, queer, biography, biography"
Our Class is a Family,"picture books, school, childrens, family, realistic fiction, school, fiction"
Who Is the Dalai Lama? (Who was...? Series),"non-fiction, biography, historical, childrens, buddhism, religion, india"
The People Shall Continue,"picture books, historical, non-fiction, native american, childrens, indigenous, cultural"
Who Was Frida Kahlo? (Who was...? Series),"non-fiction, biography, art, historical, childrens, middle grade, audiobook"
Transgender Rights and Protections,young adult
Into the Real,"lgbt, young adult, fantasy, queer, science fiction, transgender, dystopia"
Lola Levine and the Vacation Dream (Lola Levine Series),"chapter books, childrens, family, , realistic fiction, travel, cultural"
This Book Is Gay,"non-fiction, lgbt, , queer, gay, self help, humor"
How Many Stars in the Sky?,"family, picture books, realistic fiction, science, astronomy, space, african american"
Be Dazzled,"young adult, romance, contemporary, lgbt, queer, fiction, audiobook"
Virgie Goes to School with Us Boys,"picture books, historical, african american, childrens, elementary, cultural, historical"
WeirDo Series: Tasty Weird!,childrens
Last Stop on Market Street,"picture books, childrens, realistic fiction, family, fiction, cultural, african american"
The Rough-Face Girl,"picture books, childrens, fairy tales, native american, fantasy, fiction, folklore"
The Sin-Eater's Confession,"young adult, mystery, lgbt, realistic fiction, fiction, contemporary, teen"
The Skin You Live In,"picture books, childrens, cultural, race, poetry, storytime, non-fiction"
Gold Wings Rising (Skybound Series),"fantasy, young adult, lgbt, queer, fiction, young adult, high fantasy"
The Barren Grounds (The Misewa Saga Series),"fantasy, middle grade, indigenous, fiction, young adult, canada, adventure"
What We Saw,"young adult, contemporary, mystery, realistic fiction, fiction, romance, abuse"
Baseball Saved Us,"historical, picture books, sports, childrens, baseball, cultural, world war ii"
Those Shoes,"picture books, childrens, realistic fiction, poverty, fiction, school, cultural"
The Gods of Tango,"historical, fiction, lgbt, queer, historical, music, romance"
Influence,"mystery, young adult, contemporary, romance, thriller, mystery, fiction"
The Tyrant’s Tomb (The Trials of Apollo Series),"fantasy, mythology, young adult, middle grade, fiction, greek mythology, adventure"
Forever...,"young adult, romance, fiction, contemporary, , teen, classics"
The Carnival at Bray,"young adult, historical, romance, coming of age, fiction, realistic fiction, music"
No Ashes in the Fire: Coming of Age Black and Free in America,"memoir, non-fiction, lgbt, race, social, queer, biography"
Fairest: Levana's Story (The Lunar Chronicles Series),"fantasy, young adult, science fiction, retellings, dystopia, fiction, romance"
Between Shades of Gray,"historical, young adult, fiction, historical, war, world war ii, audiobook"
Breathless,"romance, young adult, contemporary, fiction, realistic fiction, coming of age, young adult"
Hachiko: The True Story of a Loyal Dog,"picture books, dogs, japan, animals, non-fiction, childrens, asia"
Destined (House of Night Series),"young adult, vampires, fantasy, paranormal, romance, supernatural, fiction"
Darius the Great Is Not Okay (Darius the Great Series),"young adult, contemporary, lgbt, fiction, mental health, queer, realistic fiction"
Ramona Blue,"young adult, lgbt, contemporary, romance, queer, fiction, audiobook"
Not So Pure and Simple,"young adult, contemporary, romance, fiction, realistic fiction, audiobook, feminism"
The Girls I've Been,"young adult, thriller, lgbt, mystery, contemporary, fiction, lesbian"
Bright World (The Hazards of Love Series),"graphic novel, fantasy, lgbt, young adult, queer, comic book, romance"
Wayward Witch (Brooklyn Brujas Series),"fantasy, young adult, witches, magic, paranormal, fiction, urban"
The Berlin Boxing Club,"historical, young adult, fiction, historical, sports, world war ii, holocaust"
The Five Stages of Andrew Brawley,"young adult, lgbt, contemporary, romance, queer, fiction, mental health"
Trail of Crumbs,"young adult, contemporary, realistic fiction, canada, retellings, fiction, teen"
Fragile Remedy,"lgbt, young adult, science fiction, fantasy, dystopia, queer, romance"
Wilma's Way Home: The Life of Wilma Mankiller,"biography, picture books, non-fiction, historical, indigenous, childrens, native american"
Bayou Magic (The Louisiana Girls Trilogy Series),"middle grade, fantasy, magic, fiction, mermaids, childrens, african american"
Dear Martin,"young adult, contemporary, fiction, realistic fiction, audiobook, race, social"
Pulp,"historical, lgbt, young adult, historical, fiction, queer, contemporary"
Lord of the Flies,"fiction, classics, young adult, school, dystopia, , school"
The You I've Never Known,"young adult, poetry, lgbt, contemporary, realistic fiction, fiction, audiobook"
Crown of Feathers (Crown of Feathers Series),"fantasy, young adult, young adult, fiction, romance, high fantasy, audiobook"
Dope Sick,"young adult, fiction, african american, realistic fiction, magic, urban, fantasy"
Teaching Truly: A Curriculum to Indigenize Mainstream Education,"education, teaching, non-fiction"
The Best at It,"middle grade, lgbt, realistic fiction, fiction, contemporary, queer, audiobook"
Ash,"fantasy, young adult, lgbt, romance, queer, fiction, retellings"
Vol. 4 (Blue Flag Series),"manga, lgbt, romance, contemporary, comic book, young adult, queer"
A ​Court of Silver Flames (A Court of Thorns and Roses Series),"fantasy, romance, romance, fiction, fae, fantasy, audiobook"
I Am Every Good Thing,"picture books, childrens, poetry, african american, realistic fiction, fiction, cultural"
Julián at the Wedding (Julián Series),"picture books, lgbt, childrens, queer, realistic fiction, family, love"
Who Is Michelle Obama? (Who was...? Series),"biography, non-fiction, historical, childrens, biography, education, african american"
Totally Joe (The Misfits Series),"young adult, lgbt, fiction, realistic fiction, queer, middle grade, teen"
Victor and Nora: A Gotham Love Story,"graphic novel, romance, young adult, comic book, comic book, superheroes, graphic novel"
They Both Die at the End,"romance, young adult, lgbt, fiction, contemporary, queer, audiobook"
Annie on My Mind,"lgbt, young adult, romance, queer, fiction, lesbian, classics"
I Am Alfonso Jones,"graphic novel, young adult, fiction, realistic fiction, comic book, contemporary, social"
Out of Darkness,"historical, young adult, , fiction, historical, romance, audiobook"
Esta bien ser diferente/It's Okay to Be Different (Spanish Version),"picture books, childrens, lgbt, cultural, fiction, storytime, family"
A Peacock Among Pigeons,"picture books, lgbt, childrens, realistic fiction"
Darkness Before Dawn,"young adult, realistic fiction, fiction, african american, contemporary, middle grade, teen"
The Boy in the Dress,"fiction, childrens, middle grade, humor, lgbt, young adult, contemporary"
Great,"young adult, retellings, contemporary, fiction, lgbt, romance, realistic fiction"
My Name Is Sally Little Song,"historical, middle grade, historical, fiction, native american, childrens, juvenile"
The Girls Are Never Gone,"horror, young adult, paranormal, lgbt, lesbian, mystery, fantasy"
Alex As Well,"lgbt, young adult, contemporary, realistic fiction, queer, fiction, intersex"
The Color of My Words,"young adult, middle grade, fiction, realistic fiction, historical, spain, cultural"
Title,genre
The Black Witch,"fantasy, young adult, witches, romance, magic, young adult, fiction"
Shadow of Night,"fantasy, romance, fiction, historical, paranormal, vampires, witches"
Somewhere Towards the End,"memoir, non-fiction, biography, autobiography, biography, essays, womens"
Chain Of Iron,"fantasy, young adult, romance, historical, young adult, urban, paranormal"
The Lesbiana's Guide to Catholic School,"romance, lgbt, young adult, queer, lesbian, contemporary, fiction"
The Rocky Road Trip of Lydia Goldblatt and Julie Graham-Chang,"middle grade, graphic novel, childrens, humor, realistic fiction, fiction, lgbt"
On Chesil Beach,"fiction, historical, literary fiction, contemporary, romance, british literature, "
Over the Edge,"romance, romance, suspense, military, contemporary, contemporary, fiction"
Captain Underpants and the Sensational Saga of Sir Stink-a-Lot,"childrens, humor, fiction, graphic novel, middle grade, chapter books, comic book"
Moonlight Becomes You,"mystery, fiction, suspense, thriller, mystery, crime, adult"
Bewitching,"fantasy, young adult, romance, fairy tales, retellings, magic, witches"
Dating Makes Perfect,"romance, young adult, contemporary, young adult, young adult, enemies to lovers, fiction"
Sons of Fortune,"fiction, thriller, historical, drama, mystery, , politics"
The Beloved Wild,"historical, young adult, historical, fiction, romance, young adult, teen"
This is Not Forgiveness,"young adult, contemporary, romance, mystery, realistic fiction, drama, fiction"
The Never Tilting World,"fantasy, young adult, lgbt, romance, young adult, lesbian, fiction"
The Realm of Possibility,"young adult, poetry, lgbt, fiction, contemporary, romance, queer"
The Way We Never Were: American Families and the Nostalgia Trap,"historical, non-fiction, social, feminism, politics, american, historical"
An Echo in the Bone,"historical, romance, fantasy, fiction, time travel, historical, historical"
Skeleton Crew,"horror, short stories, fiction, fantasy, thriller, anthology, audiobook"
The Project,"young adult, thriller, mystery, contemporary, mystery, fiction, audiobook"
The Black Dahlia,"mystery, fiction, crime, noir, historical, true crime, thriller"
Anatomy of a Single Girl,"young adult, romance, new adult, contemporary, realistic fiction, fiction, young adult"
Things in Jars,"historical, fantasy, mystery, fiction, magic, historical, gothic"
They Wish They Were Us,"mystery, young adult, thriller, mystery, contemporary, fiction, audiobook"
Lucky Penny,"graphic novel, romance, young adult, humor, fiction, graphic novel, contemporary"
Queen of the Damned,"horror, fantasy, vampires, fiction, paranormal, supernatural, urban"
Home After Dark,"graphic novel, comic book, fiction, young adult, coming of age, historical, graphic novel"
The Perks of Being a Wallflower,"young adult, fiction, classics, coming of age, romance, mental health, realistic fiction"
See You at Harry's,"young adult, realistic fiction, middle grade, contemporary, fiction, family, death"
The World's Strongest Librarian: A Book Lover's Adventures,"non-fiction, memoir, biography, books about books, biography, audiobook, humor"
Murder of Crows,"young adult, mystery, lgbt, contemporary, mystery, fiction, thriller"
The Infinite Moment of Us,"young adult, romance, contemporary, realistic fiction, fiction, , teen"
13 Minutes,"young adult, mystery, thriller, fiction, contemporary, mystery, crime"
If There Be Thorns,"fiction, horror, young adult, romance, gothic, thriller, drama"
Slay,"young adult, contemporary, fiction, audiobook, realistic fiction, science fiction, young adult"
Anne Frank: The Anne Frank House Authorized Graphic Biography,"graphic novel, biography, non-fiction, historical, holocaust, comic book, historical"
Paradise Lost and Paradise Regained,"classics, poetry, fiction, , religion, philosophy, fantasy"
I Was a Teenage Fairy,"young adult, fantasy, fiction, magic, urban, romance, teen"
Beyond the Gender Binary,"non-fiction, lgbt, queer, gender, feminism, audiobook, memoir"
Banned Book Club,"graphic novel, non-fiction, memoir, historical, historical, biography, politics"
We All Looked Up,"young adult, contemporary, fiction, science fiction, romance, dystopia, realistic fiction"
In the Belly of the Beast: Letters From Prison,"non-fiction, biography, true crime, crime, memoir, psychology, biography"
Hear These Voices: Youth at the Edge of the Millennium,", non-fiction"
Dreaming of Antigone,"young adult, contemporary, romance, abuse, realistic fiction, poetry, death"
Anna and the French Kiss,"romance, young adult, contemporary, fiction, chick lit, realistic fiction, contemporary"
Ripley's Believe It or Not!: Shatter Your Senses!,"non-fiction, trivia"
The Awesomely Awful Melodies of Lydia Goldblatt and Julie Graham-Chang,"middle grade, graphic novel, childrens, humor, realistic fiction, juvenile, graphic novel"
The Girl Who Loved Tom Gordon,"horror, fiction, thriller, suspense, mystery, fantasy, audiobook"
Big Nate: A Good Old-Fashioned Wedgie,"graphic novel, humor, childrens, comic book, fiction, middle grade, juvenile"
Cherry Money Baby,"young adult, contemporary, romance, realistic fiction, fiction, coming of age, chick lit"
Dreamcatcher,"horror, fiction, science fiction, thriller, fantasy, aliens, supernatural"
The Food Chain (Play),"plays, theatre, drama"
The Waste Lands,"fantasy, fiction, horror, science fiction, audiobook, adventure, westerns"
Singin' and Swingin' and Gettin' Merry Like Christmas,"non-fiction, memoir, biography, autobiography, biography, african american, classics"
Messed Up,"young adult, realistic fiction, teen, fiction, urban, drama, survival"
Ramona Blue,"young adult, lgbt, contemporary, romance, queer, fiction, audiobook"
Shadow of the Hegemon,"science fiction, fiction, science fiction, fantasy, young adult, audiobook, adventure"
Written in My Own Heart's Blood,"historical, romance, fiction, fantasy, time travel, historical, historical"
I Know Why The Caged Bird Sings,"non-fiction, classics, memoir, biography, autobiography, poetry, feminism"
They Called Themselves The K.K.K.: The Birth of an American Terrorist Group,"non-fiction, historical, american, historical, teen, race, african american"
Fifty Shades of Grey,"fiction, erotica, bdsm, adult, contemporary, contemporary, chick lit"
You're Next,"mystery, young adult, thriller, lgbt, mystery, contemporary, fiction"
King of Battle and Blood,"fantasy, vampires, fantasy, romance, enemies to lovers, paranormal, adult"
Flawless,"young adult, mystery, fiction, contemporary, romance, chick lit, thriller"
The Last Words We Said,"young adult, romance, contemporary, judaism, realistic fiction, fiction, judaism"
Light Years,"young adult, israel, fiction, teen, realistic fiction, adult, war"
Micro,"science fiction, fiction, thriller, adventure, mystery, audiobook, horror"
Now Sheba Sings the Song,"poetry, art, african american, non-fiction"
Life,"music, biography, non-fiction, memoir, autobiography, audiobook, biography"
Red at the Bone,"fiction, historical, audiobook, contemporary, literary fiction, adult, lgbt"
Stolen Girl,"historical, middle grade, historical, young adult, fiction, world war ii, war"
The Feeling of Falling in Love,"romance, lgbt, queer, young adult, contemporary, fiction, transgender"
The Dharma Bums,"fiction, classics, , , travel, philosophy, american"
The Nowhere Girls,"young adult, contemporary, feminism, lgbt, fiction, realistic fiction, young adult"
Terrorism Inc.: The Financing of Terrorism Insurgency and Irregular Warfare,non-fiction
Are These My Basoomas I See Before Me: Fab Final Confessions of Georgia Nicolson,"young adult, romance, humor, fiction, contemporary, chick lit, teen"
The Love and Lies of Rukhsana Ali,"young adult, lgbt, contemporary, queer, romance, fiction, lesbian"
The Grownup,"short stories, fiction, horror, thriller, mystery, mystery, audiobook"
Hoop City: Chicago,"sports, young adult, realistic fiction"
On the Volcano,"historical, young adult, westerns, survival, coming of age, historical"
A Secret Kept,"fiction, historical, france, mystery, adult, contemporary, audiobook"
Leonardo da Vinci,"biography, art"
Opposition,"young adult, fantasy, romance, paranormal, aliens, science fiction, paranormal"
That Hideous Strength: A Modern Fairy-Tale for Grown-Ups,"fiction, science fiction, fantasy, christianity, classics, christianity, science fiction"
Playing Hard to Get,"sports, romance, sports, college, football, new adult, friends to lovers"
Ender's Shadow,"science fiction, fiction, young adult, fantasy, science fiction, audiobook, space"
Kingdom of Ash,"young adult, romance, romance, fae, fiction, magic, new adult"
The Second Summer Of The Sisterhood,"young adult, fiction, chick lit, contemporary, romance, teen, realistic fiction"
The Black Kids,"young adult, historical, contemporary, fiction, audiobook, historical, race"
After We Collided,"romance, new adult, young adult, contemporary, fiction, college, contemporary"
Fly on the Wall: How One Girl Saw Everything,"young adult, contemporary, fantasy, fiction, romance, magic, chick lit"
The Imitation Game: Alan Turing Decoded,"graphic novel, non-fiction, biography, historical, comic book, science, lgbt"
Since You've Been Gone,"young adult, contemporary, romance, fiction, young adult, realistic fiction, audiobook"
The Hate U Give,"young adult, fiction, contemporary, audiobook, realistic fiction, race, social"
The List of Things That Will Not Change,"middle grade, realistic fiction, lgbt, fiction, family, contemporary, audiobook"
Say What You Will,"young adult, romance, contemporary, fiction, realistic fiction, disability, mental health"
All That's Left in the World,"romance, lgbt, young adult, queer, dystopia, science fiction, fiction"
Recess Warriors: Hero Is A Four-Letter Word,"graphic novel, fantasy, middle grade, comic book, juvenile, adventure, childrens"
Big Nate: The Crowd Goes Wild,"graphic novel, comic book, childrens, humor, fiction, middle grade, school"
The Absolute Value of -1,"young adult, contemporary, fiction, realistic fiction, death, teen"
Maus 1: A Survivor's Tale: My Father Bleeds History,"graphic novel, comic book, historical, non-fiction, memoir, holocaust, biography"
Snakeroot,"young adult, fantasy, paranormal, werewolves, romance, magic, supernatural"
All the Invisible Things,"lgbt, young adult, contemporary, queer, romance, fiction, bisexual"
Two-Way Street,"young adult, romance, contemporary, road trip, chick lit, realistic fiction, fiction"
You Don't Know Me,"young adult, fiction, realistic fiction, abuse, contemporary, teen, high school"
Lobizona,"fantasy, young adult, fiction, magic, paranormal, urban, young adult"
The Passage,"horror, fiction, science fiction, fantasy, post apocalyptic, vampires, dystopia"
Confessions of a Shopaholic,"chick lit, fiction, romance, contemporary, humor, adult, contemporary"
Cut,"young adult, fiction, mental health, realistic fiction, mental health, contemporary, psychology"
Kindred: A Graphic Novel Adaptation,"graphic novel, historical, fiction, science fiction, time travel, fantasy, historical"
Christine,"horror, fiction, thriller, fantasy, paranormal, supernatural, mystery"
Divine Secrets of the Ya-Ya Sisterhood,"fiction, chick lit, contemporary, adult, historical, southern, adult"
Blackout,"romance, young adult, short stories, contemporary, lgbt, fiction, audiobook"
Sudden Fiction: American Short Stories,"short stories, fiction, anthology, fiction, literary fiction, contemporary, school"
Hurricane Child,"middle grade, lgbt, magic, queer, fiction, young adult, contemporary"
Bangkok 8,"mystery, fiction, crime, thriller, asia, mystery, detective"
Wonder Woman: Warbringer,"fantasy, young adult, superheroes, fiction, mythology, audiobook, retellings"
Elevation,"fiction, horror, fantasy, audiobook, short stories, mystery, novella"
Insatiable,"romance, vampires, fantasy, paranormal, chick lit, fiction, paranormal"
Princess in Training,"young adult, romance, fiction, contemporary, chick lit, teen, childrens"
Plague in the Mirror,"young adult, historical, time travel, fantasy, romance, paranormal, historical"
Bloody Valentine,"vampires, young adult, fantasy, paranormal, romance, angels, urban"
When Aidan Became a Brother,"picture books, lgbt, family, childrens, realistic fiction, queer, gender"
Illuminae,"science fiction, young adult, romance, fantasy, fiction, audiobook, dystopia"
Who Is Dolly Parton?,"biography, non-fiction, childrens, music, middle grade, historical, biography"
Monsters,"young adult, zombies, dystopia, horror, post apocalyptic, science fiction, fiction"
Wuthering Heights,"fiction, gothic, historical, , historical, , 19th century"
Too Soon For Jeff,"fiction, young adult, teen"
Lightning,"romance, fiction, chick lit, contemporary, adult, contemporary, drama"
Sleeping Beauties,"horror, fantasy, fiction, thriller, audiobook, mystery, science fiction"
Everything Everything,"young adult, romance, contemporary, fiction, realistic fiction, audiobook, young adult"
